id;id_ex;siret;rup_mi;gestion;date_creat;date_decla;date_publi;date_disso;nature;groupement;titre;titre_court;objet;objet_social1;objet_social2;adrs_complement;adrs_numvoie;adrs_repetition;adrs_typevoie;adrs_libvoie;adrs_distrib;adrs_codeinsee;adrs_codepostal;adrs_libcommune;adrg_declarant;adrg_complemid;adrg_complemgeo;adrg_libvoie;adrg_distrib;adrg_codepostal;adrg_achemine;adrg_pays;dir_civilite;siteweb;publiweb;observation;position;maj_time
"W9J1000002";"";"";"";"9J1T";"2010-09-28";"2010-09-28";"2010-12-18";"0001-01-01";"D";"S";"ALSOPHIS";"ALSOPHIS";"étudier, protéger, sauvegarder et réhabilité les espèces animales et végétales sauvages des Antilles ; oeuvrer pour la connaissance, la conservation, la restauration et la valorisation de la biodiversité des Antilles";"024025";"024030";"";"57";"";"VILL1";"Créole saint-jean";"_";"97701";"97133";"Saint-Barthélemy";"";"";"";"57 villa créole saint-jean";"";"97133";"Saint-Barthélemy";"FRANCE";"PM";"";"0";"";"A";"2010-12-21 17:49:44"
"W9J1000003";"";"";"";"9J1T";"2010-10-18";"2010-10-18";"2010-12-18";"0001-01-01";"D";"S";"CRAZY TROOP";"CRAZY TROOP";"préparer ses adhérents aux festivités du mardi gras mais aussi tout autre évènement ponctuel durant l'année avec un maximum de six représentations par an";"006045";"000000";"appartement 52, Saint-Jean";"";"";"VILL1";"Créole";"_";"97701";"97133";"Saint-Barthélemy";"";"villa créole appt 52";"B.P 21";"saint-jean";"";"97133";"Saint-Barthélemy";"FRANCE";"PM";"http://facebook.com/crazytroop";"0";"";"A";"2010-12-21 17:49:44"
"W9J1000004";"";"";"";"9J1T";"2010-10-25";"2022-11-16";"2010-12-18";"0001-01-01";"D";"S";"THE YOUNGZ";"THE YOUNGZ";"organiser plusieurs manifestations concernant les fêtes de l'île ainsi que sa fête patronale, des week-ends et soirées culturelles, l'artisanat de l'île, la musique, la danse traditionnelles et modernes, organiser différentes foires, et toutes organisations culturelles publiques ou bien privées, et les autres fêtes de l'année ; prévoir par le biais de plusieurs personnes pratiquants différents sport l'encadrement de jeunes qui souhaiterai d'une part pratiqué une activité sportive de n'importe quel genre et d'autre part participé aux évènements sportifs qui figurent déjà sur l'île ; former des jeunes et moins jeunes dans différents secteurs tels que l'aide aux personnes dans le besoin, aide à l'amélioration de l'habitat, aide à l'insertion de la dite nouvelle génération autrement dit des jeunes dans la société actuelle ainsi que l'aide aux familles en difficultées ; constituer, établir une relation permanente, une coordination et un partenariat avec tous les différents organismes, collectivités locales et territoriales, responsable de : développement de restauration du patrimoine, aménagement du territoire, du tourisme, de l'insertion, de l'habitat, de l'action sociale, du culturel";"006000";"011000";"citerne communale";"";"";"RUE";"public";"_";"97701";"97133";"Saint-Barthélemy";"";"CITERNE COMMUNAL LOCAL ASP";"";"PUBLIC";"";"97133";"SAINT-BARTHéLEMY";"FRANCE";"PF";"";"0";"";"A";"2022-11-18 16:15:32"
"W9J1000005";"24/04/94";"";"";"9J1T";"1994-04-24";"2021-08-09";"1901-07-01";"0001-01-01";"D";"S";"ROTARY CLUB DE SAINT-BARTHELEMY";"ROTARY CLUB DE SAINT-BARTHELEMY";"développer des relations personnelles d'amitié entre ses membres en vue de leur fournir des occasions de servir l'intérêt général";"019000";"000000";"Anse des cayes";"";"";"";"Hôtel Manapany";"_";"97701";"97133";"Saint-Barthélemy";"";"Anse des cayes";"";"Hôtel Manapany";"";"97133";"Saint-Barthélemy";"FRANCE";"PM";"";"1";"";"A";"2021-08-17 14:06:45"
"W9J1000006";"10/08/1995";"";"";"9J1T";"1995-08-10";"2015-11-13";"1995-08-23";"0001-01-01";"D";"S";"SAINT-BARTH HARMONY";"SAINT-BARTH HARMONY";"faire vivre la musique au sein des jeunes gens de l'île ainsi qu'aux moins jeunes, promouvoir la musique au sein de saint-barthélemy en nous occupant de la formation des jeunes musiciens, de leur découverte de la musique, s'occuper de représentations et spectacles que cette association pourrait organiser, faire valoir ses droits et sa propriété musicale sur ses spectacles et oeuvres originales, veiller à ce que le règlement intérieur et le cahier des charges tant sur le plan de la formation que celui de la sécurité soient respectés afin que les adhérents bénéficient du meilleur enseignement, veiller à ce que les fonds engagés par les parents, les donateurs, les collectivités publiques soient utilisés à bon escient pour la plus grande efficacité dans la formation des musiciens, s'assurer que le personnel accomplit bien les tâches pour lesquelles il a été embauché, s'assurer que le personnel ait les avantages auxquels il a droit tant sur le plan financier qu'en ce qui concerne les horaires ou sur l'aide qu'il devra recevoir pour exécuter son travail,";"006030";"000000";"ancienne école Alcide Terrac";"";"";"";"Colombier";"_";"97701";"97133";"Saint-Barthélemy";"";"B.P 38";"";"COLOMBIER";"";"97133";"SAINT-BARTHÉLEMY";"FRANCE";"PM";"";"1";"";"A";"2015-11-16 19:43:53"
"W9J1000007";"22/02/1984";"";"";"9J1T";"1984-03-09";"2023-10-05";"1984-04-01";"0001-01-01";"D";"S";"ASSOCIATION DES PARENTS D'ELEVES DU COLLEGE MIREILLE CHOISY DE ST BARTHELEMY";"ASSOCIATION DES PARENTS D'ELEVES D...";"défendre les intérêts moraux et matériels des parents d'élèves, informer les familles sur la vie scolaire de leur enfant, représenter les parents d'élèves en participant aux conseils d'administration des établissements scolaires et aux conseils de classe, apporter son soutien à l'établissement et contribuer à son animation, participer à la vie de la communauté éducative dans le respect des compétences de chacun des partenaires, promouvoir le caractère propre exprimé dans le projet éducatif de l'établissement en collaboration avec ses responsables et les organismes qui s'y intéressent";"015005";"000000";"Collège Mireille Choisy";"";"";"";"Gustavia";"_";"97701";"97133";"Saint-Barthélemy";"";"";"";"COLOMBIER B.P 17";"";"97012";"SAINT-BARTHÉLEMY";"FRANCE";"PF";"";"1";"";"A";"2023-10-13 18:09:03"
"W9J1000008";"25/06/1984";"";"";"9J1T";"1984-06-25";"2012-10-11";"1984-07-25";"0001-01-01";"D";"S";"RADIO SAINT BARTH FM";"RADIO SAINT BARTH FM";"créer et exploiter une radio libre à Saint-Barthélemy, à Saint-Martin et toutes les îles avoisinantes ainsi que sur internet et satellite dans le cadre de la loi de novembre 1981 et décret du 20 janvier 1982 et permettre la mise en oeuvre d'autres moyens d'expression, journal, télétexte, vidéo";"005010";"000000";"B.P 1113";"";"";"";"Colombier";"_";"97701";"97133";"Saint-Barthélemy";"";"Chez Robert GREAUX";"";"N° 2 Colombier";"";"97133";"Saint-Barthélemy";"FRANCE";"PM";"";"1";"";"A";"2012-10-17 14:13:55"
"W9J1000009";"08/04/2008";"";"";"9J1T";"2008-04-07";"2025-08-06";"2008-05-10";"0001-01-01";"D";"S";"COMITE TERRITORIAL DU TOURISME DE SAINT-BARTHELEMY";"CTTSB";"accueillir et informer le public ainsi que promouvoir le tourisme de l'île de saint-barthélemy sur le plan local, régional et à l'étranger ; étudier et réaliser des mesures tendant à accroître l'activité touristique ; élaborer et mettre en oeuvre un schéma global et de développement du tourisme de saint-barthélemy ; produire des statistiques et des outils statistiques ; contribuer à coordonner les interventions des divers partenaires du développement touristique local en chef d'orchestre de la politique touristique ; élaborer et mettre en oeuvre la politique du tourisme local et des programmes locaux de développement touristique notamment dans les domaines de l'élaboration des services touristiques, de l'exploitation d'installations touristiques et de loisirs, des études, de l'animation des loisirs, de l'organisation de fêtes et de manifestations culturelles ayant une vocation touristique, de programmes de formation, de conception de produits touristiques et de services de communication par internet ou intranet ; s'associer à un ou plusieurs organismes ayant une vocation touristique pour entreprendre des actions d'intérêts interrégional, national ou international, participer à tout organisme ayant une personnalité morale et un objet semblable pour une durée limitée ou une durée illimitée.";"034240";"000000";"Office du Tourisme";"";"";"";"Gustavia";"_";"97701";"97133";"Saint-Barthélemy";"";"";"";"Saint-Jean";"";"97133";"Saint-Barthélemy";"FRANCE";"PF";"";"1";"";"A";"2025-08-11 12:14:24"
"W9J1000010";"25/11/1996";"";"";"9J1T";"1996-11-25";"2022-06-24";"1901-07-01";"2021-08-31";"D";"S";"ASSOCIATION DES PARENTS D'ELEVES DE L'ECOLE PRIMAIRE DE GUSTAVIA";"A.P.E.E.P.G.";"rechercher et discuter en commun toutes les améliorations désirables dans l'intérêt des élèves, saisir l'administration des voeux émis à ce sujet, poursuivre la réalisation par tous les moyens en son pouvoir, faciliter le fonctionnement et l'organisation de la vie scolaire, créer des animations au moment des fêtes scolaires, rester à l'écoute des parents d'élèves et les informer";"015005";"000000";"Ecole Primaire";"";"";"";"Gustavia";"_";"97701";"97133";"Saint-Barthélemy";"";"Rue de la paix B.P 173";"";"Gustavia";"";"97133";"Saint-Barthélemy";"FRANCE";"PF";"";"1";"";"D";"2022-07-07 14:44:55"
"W9J1000011";"16/03/1992";"";"";"9J1T";"1992-03-16";"2024-11-12";"1992-04-22";"0001-01-01";"D";"S";"SB JAM";"SB JAM";"favoriser, developper et promouvoir notamment la creation d'evenements culturels, artistiques, sportifs ou constituant de simples divertissements ; production evenementielle et organisation de spectacles et evenements, diffusion et promotion de spectacles vivants ou manifestations, organisation et creation de manifestations culturelles et d'actions d'education artistique, toute autre activite contribuant a l'objet de l'association ;";"006030";"000000";"BOIS-NEUF";"";"";"";"COLOMBIER";"_";"97701";"97133";"Saint-Barthélemy";"";"CHEZ GREAUX JOANNA";"";"COLOMBIER";"";"97133";"SAINT-BARTHÉLEMY";"FRANCE";"PF";"";"1";"";"A";"2025-02-04 09:58:42"
"W9J1000012";"";"";"";"9J1T";"2010-11-18";"2023-01-31";"2010-12-18";"2023-01-11";"D";"S";"ASSOCIATION SAINT-BARTH HANDICAP";"A.S.B.H.";"accueillir, aider, et orienter toutes les familles et plus généralement toutes personnes assurant la responsabilité  d'un enfant, adolescent ou adulte ayant un handicap mental ou physique, développer entre elles un esprit d'entraide et de solidarité et de les amener à participer activement à la vie associative ; assurer, coordonner et promouvoir les démarches administratives et les représentations auprès des autorités de tutelle des pouvoirs publics, des élus dans la région, l'information des médias, les manifestations collectives nécessaires à la reconnaissance aux qualités de personnes affectées d'un handicap moral ou physique ; établir une concertation étroite avec les autres associations de la région et toutes personnes physiques ou morales avec lesquelles, l'A.S.B.H. agit en faveur des personnes ayant un handicap mental ou physique quelle que soit la nature du handicap ; susciter et aider autant que de besoin, la création de structures appropriées";"017130";"000000";"";"";"";"";"Corossol";"_";"97701";"97133";"Saint-Barthélemy";"";"ALC";"";"COROSSOL";"";"97133";"SAINT-BARTHéLEMY";"FRANCE";"PM";"";"0";"";"D";"2023-02-14 12:45:39"
"W9J1000013";"27/11/2008";"";"";"9J1T";"2008-11-27";"2025-05-23";"2008-12-20";"0001-01-01";"D";"S";"LA FERME DES ILES";"LA FERME DES ILES";"concevoir, mettre en oeuvre, exploiter et animer la ferme d'animation pédagogique, organiser différentes manifestations (stages, événements, ateliers, expositions), ainsi que l'enrichissement des projets pédagogiques des écoles par un contact des élèves avec la nature et les animaux";"011050";"000000";"";"";"";"";"";"_Gouverneur";"97701";"97133";"Saint-Barthélemy";"";"MERLETTE";"";"";"B.P 1073";"97133";"SAINT-BARTHÉLEMY";"FRANCE";"PM";"";"1";"";"A";"2025-06-30 12:15:31"
"W9J1000014";"";"";"";"9J1T";"2010-12-13";"2010-12-13";"2010-12-25";"0001-01-01";"D";"S";"PETITS-PLUS";"PETITS-PLUS";"aider des orphelinats au brésil par le biais de parrainages, de dons ponctuels pour achats de vêtements, nourritures, fournitures, etc";"020010";"020005";"Le Rocher Public";"";"";"";"";"_";"97701";"97133";"Saint-Barthélemy";"";"Le Rocher Public apt 2 bloc 2";"B.P 352";"";"";"97133";"Saint-Barthélemy";"FRANCE";"PF";"";"0";"";"A";"2011-01-03 17:43:39"
"W9J1000015";"";"";"";"9J1T";"2010-12-16";"2010-12-16";"2010-12-25";"0001-01-01";"D";"S";"RESSOURCES PARENTALITE";"RESSOURCES PARENTALITE";"soutenir la parentalité et accompagner les parents et les enfants ; vendre des produits et organiser des prestations et manifestations payantes";"019004";"000000";"SAINT-JEAN";"";"";"";"";"_";"97701";"97133";"Saint-Barthélemy";"";"SAINT-JEAN";"B.P 320";"";"";"97133";"Saint-Barthélemy";"FRANCE";"PF";"";"0";"";"A";"2011-01-03 17:43:18"
"W9J1000016";"";"";"";"9J1T";"2010-12-15";"2010-12-15";"2011-01-01";"0001-01-01";"D";"S";"KARIBBEAN FIESTA";"KARIBBEAN FIESTA";"organiser des évènements musicaux tels que soirées et dîners dansants, soirées saisonnières et soirées carnavalesques ainsi que d'autres soirées ; aider d'autres associations ou collectivités par un apport matériel ainsi que de nos compétences ou permettre la sonorisation de groupes musicaux ; permettre aux adhérents de s'initier et d'assurer ces évènements à l'aide d'un parc matériel adapté, performant et de qualité";"006030";"000000";"Anse des cayes";"";"";"";"";"_";"97701";"97133";"Saint-Barthélemy";"";"Anse des cayes";"";"";"";"97133";"Saint-Barthélemy";"FRANCE";"PM";"";"0";"";"A";"2010-12-31 09:39:39"
"W9J1000017";"26/02/1996";"";"";"9J1T";"1996-02-26";"2022-05-13";"1996-04-03";"0001-01-01";"D";"S";"FEDERATION DES ANCIENS COMBATTANTS DE SAINT-BARTHELEMY";"FEDERATION DES ANCIENS COMBATTANTS ...";"resserer les liens unissant les anciens combattants, les titulaires du T.R.N., les anciens résistants et les anciens déportés ; leur venir en aide ainsi qu'à leurs familles ; défendre leurs intérêts matériels et moraux et les représenter en cas de besoin ; établir et développer les contacts entre les anciens combatttants français et alliées";"038105";"000000";"Mairie de Saint-Barthélemy";"";"";"";"Gustavia";"_";"97701";"97133";"Saint-Barthélemy";"";"Marigot";"";"";"";"97133";"Saint-Barthélemy";"FRANCE";"PM";"";"1";"";"A";"2022-05-17 17:11:28"
"W9J1000018";"";"";"";"9J1T";"2011-01-03";"2013-01-21";"2011-01-15";"0001-01-01";"D";"S";"CLUB AERONAUTIQUE DE SAINT-BARTHELEMY";"C.A.S.B.";"permettre le brassage, les échanges, l'entraide entre tous les personnels du monde de l'aviation ; promouvoir, développer l'aviation privée et les sports aériens par toutes manifestation, conférences, publications, cours, rassemblements, parrainages, bourses ; organiser le rassemblement des pilotes privés à Saint-Jean ou toutes autres manifestations aériennes ; organiser des colloques avec interventions de personnalités ; organiser des causeries sur les métiers de l'aviation ; organiser des stages d'initiation aux métiers de l'aéronautique";"007002";"000000";"";"";"";"";"Saint-Jean Carénage";"_";"97701";"97133";"Saint-Barthélémy";"";"B.P 274";"GUSTAVIA";"";"";"97133";"SAINT-BARTHéLEMY";"FRANCE";"PM";"";"0";"";"A";"2013-07-23 20:00:03"
"W9J1000019";"";"";"";"9J1T";"2011-01-04";"2015-07-22";"2011-01-15";"0001-01-01";"D";"S";"ST BARTH ROCKS";"ST BARTH ROCKS";"développer des activités culturelles et musicales";"006030";"000000";"Camaruche";"";"";"";"villa Yellow";"_";"97701";"97133";"Saint-Barthélemy";"";"Hôtel Tom Beach Saint-Jean";"B.P 1058";"";"";"97133";"Saint-Barthélemy";"FRANCE";"PM";"";"0";"";"A";"2015-08-31 22:37:06"
"W9J1000020";"31/07/2001";"";"";"9J1T";"2001-07-31";"2011-02-02";"2001-08-25";"0001-01-01";"D";"S";"AVIATEURS ASSOCIES DE SAINT BARTHELEMY";"A A S B";"promouvoir , faciliter et organiser la pratique de l'aviation et des différentes activités s'y rattachant notamment par des opérations de découverte de l'aviation auprès du public et par la formation de pilotes, l'entraînement, le voyage et l'instruction technique nécessaires, tant à l'aide de moyens privés que de moyens d'état, à effect de développer l'aviation générale comme de préparer aux carrières ou métiers y ressortissant";"007002";"000000";"Aéroport de Saint-Jean";"";"";"";"";"_";"97701";"97133";"Saint-Barthélemy";"";"Aéroport de Saint-Jean";"";"";"";"97133";"Saint-Barthélemy";"FRANCE";"PM";"";"1";"";"A";"2011-08-04 20:00:02"
"W9J1000021";"15/12/1978";"";"";"9J1T";"1978-12-15";"2024-03-19";"1901-07-01";"0001-01-01";"D";"S";"ORGANISME DE GESTION DE L'ECOLE CATHOLIQUE SAINTE MARIE DE COLOMBIER";"ORGANISME DE GESTION DE L'ECOLE CA...";"assumer juridiquement la gestion d'établissements d'enseignement fondés par l'autorité canonique comptétente";"015035";"000000";"Colombier";"";"";"";"Ecole Sainte Marie";"_";"97701";"97133";"Saint-Barthélemy";"";"Colombier";"lieu dit Hansen";"";"";"97133";"Saint-Barthélemy";"FRANCE";"PM";"";"1";"";"A";"2024-03-19 19:46:54"
"W9J1000022";"";"";"";"9J1T";"2011-01-24";"2014-06-10";"2011-02-12";"0001-01-01";"D";"S";"ASSOCIATION DES CONSOMMATEURS ET USAGERS DE SAINT-BARTHELEMY";"ASSOCIATION DES CONSOMMATEURS ET US...";"aider, soutenir, informer et accompagner les consommateurs et usagers de la collectivité de Saint-Barthélemy";"023002";"000000";"Colombier Bois neuf";"";"";"";"";"_";"97701";"97133";"Saint-Barthélemy";"";"Colombier Bois neuf";"";"";"";"97133";"Saint-Barthélemy";"FRANCE";"PM";"";"0";"";"A";"2014-07-02 13:47:46"
"W9J1000023";"28/10/1988";"";"";"9J1T";"1988-10-28";"2025-02-06";"1901-07-01";"0001-01-01";"D";"S";"AMICALE BOULISTE DE SAINT-BARTHELEMY";"A.B.S.B.";"pratiquer la pétanque et le jeu provençal";"011035";"000000";"Gustavia";"";"";"";"Hôtel de la Collectivité";"_";"97701";"97133";"Saint-Barthélemy";"";"B.P 396";"GUSTAVIA";"";"";"97095";"SAINT-BARTHéLEMY CéDEX";"FRANCE";"PF";"";"1";"";"A";"2025-02-17 18:45:29"
"W9J1000024";"25/08/1986";"";"";"9J1T";"1986-08-25";"2017-10-20";"1986-09-17";"0001-01-01";"D";"S";"RUGBY CLUB DE SAINT-BARTHELEMY ""LES BARRACUDAS""";"RUGBY CLUB DE SAINT-BARTHELEMY ""LE...";"développer et favoriser par tous les moyens appropriés sur le plan sportif la pratique du rugby à quinze";"011080";"000000";"Saint-Jean Morne tourterelles";"";"";"";"";"_";"97701";"97133";"Saint-Barthélemy";"";"Saint-Jean Morne tourterelles";"";"";"";"97133";"Saint-Barthélemy";"FRANCE";"PM";"";"1";"";"A";"2017-10-24 16:00:38"
"W9J1000025";"06/12/1974";"";"";"9J1T";"1974-12-06";"2022-12-01";"1975-01-11";"0001-01-01";"D";"S";"ASSOCIATION DES JEUNES OUVRIERS ET ETUDIANTS DE SAINT BARTHELEMY";"A.J.O.E.S.B";"aider au développement et à l'épanouissement physique, moral et intellectuel des jeunes dans un cadre sain et amical ; promourvoir l' initiation et la pratique des sports ; organiser des centres de vacances et de loisirs, de pique-niques, de voyages organisés ; organiser des évènements sportifs ou culturels ; organiser des rencontres de jeunes, conférences, projections, projections de films, séances théâtrales et récréatives, organiser un espace bibliothèque";"006000";"000000";"Lorient";"";"";"";"";"_";"97701";"97133";"Saint-Barthélemy";"";"Lorient";"";"";"";"97133";"Saint-Barthélemy";"FRANCE";"PF";"";"1";"";"A";"2022-12-13 14:37:16"
"W9J1000026";"12/04/2005";"";"";"9J1T";"2005-04-12";"2025-07-02";"2005-05-21";"0001-01-01";"D";"S";"ASSOCIATION SPORTIVE ET CULTURELLE PORTUGAISE DE SAINT-BARTH";"A.S.C.P.S.B.";"promouvoir et développer tout projet culturel, sportif, artistique ou autre, permettant de développer la qualité du cadre de vie de la communauté portugaise de l'île de saint-barthélemy";"011005";"000000";"Corossol";"";"";"";"";"_";"97701";"97133";"Saint-Barthélemy";"";"A.S.C.P.S.B.";"SAINT-JEAN";"B.P 1346";"";"97133";"SAINT-BARTHÉLEMY";"FRANCE";"PM";"";"1";"";"A";"2025-07-03 12:31:09"
"W9J1000027";"";"";"";"9J1T";"2011-04-05";"2012-01-13";"2011-04-30";"0001-01-01";"D";"S";"SAINT BARTH BLEUE ET VERTE";"SBH BLEUE ET VERTE";"promouvoir des idées et des actions qui ont pour finalité à saint barthélémy, l'épanouissement de la liberté, le développement durable sous toutes ses formes notamment un urbanisme harmonieux et humain, un environnement sauvegardé, la mise en oeuvre des énergies renouvelables et l'émergence d'une légalité intelligente et naturellement respectée par tous, la réflexion seule ou en groupe pour nourrir le débat public d'idées et de propositions qui contribueront à l'élaboration d'un projet de société pour saint barthélémy, l'information, la représentation et la défense des habitants de saint barthélémy pris notamment en qualité d'usagers des services publics ou de consommateurs, la participation au débat public sous toutes ses formes y compris lors des consultations électorales";"050000";"000000";"Grand Cul de Sac";"";"";"";"";"_";"97701";"97133";"Saint-Barthélemy";"";"villa BRIN";"Vitet";"";"BP 115 Saint-Jean";"97133";"Saint-Barthélemy";"FRANCE";"PM";"";"0";"";"A";"2012-01-19 15:21:49"
"W9J1000028";"20/03/1987";"";"";"9J1T";"2011-04-19";"2011-03-22";"1987-04-15";"0001-01-01";"D";"S";"SAINT-BARTH VOLLEY-BALL CLUB";"SBVBC";"organiser et développer la pratique l'encadrement des jeunes et développer les activités et les initiatives dans divers domaines notamment le volley ball et le beach volley sous toutes leurs formes parmi des adhérents résident dans la collectivité de Saint-Barthélemy et de participer aux tournois et compétitions organisées par les instances responsables en titre de la discipline";"011085";"000000";"";"";"";"";"Vitet";"_";"97701";"97133";"Saint-Barthélemy";"";"SBVBC";"VITET";"";"";"97133";"SAINT-BARTHÉLEMY";"FRANCE";"PM";"";"1";"";"A";"2011-05-07 11:44:26"
"W9J1000029";"";"";"";"9J1T";"2011-04-18";"2011-04-18";"2011-05-07";"0001-01-01";"D";"S";"LA MAISON DE LA PETITE ENFANCE DE SAINT-BARTHELEMY ""LA CASE A LINDA""";"M.P.E ST-BARTHELEMY ""LA CASE A LIN...";"organiser toutes actions favorisant la mise en place d'un service d'accueil de proximité, pour les enfants de 0 à 6 ans en fonction des besoins des familles ; mettre à disposition des parents une strutcture d'accueil adéquat et assurer la gestion de l'établissement ; concourir au développement, à l'éducation, à l'épanouissement physique, sensoriel et affectif de l'enfant ainsi qu'à son éveil culturel et à sa socialisation";"021005";"000000";"Carénage Saint-Jean";"";"";"";"";"_";"97701";"97133";"Saint-Barthélemy";"";"Carénage Saint-Jean";"B.P 402";"";"";"97133";"Saint-Barthélemy";"FRANCE";"PM";"";"0";"";"A";"2011-05-07 11:39:41"
"W9J1000030";"";"";"";"9J1T";"2011-04-28";"2011-04-28";"2011-05-21";"0001-01-01";"D";"S";"ST-BARTH HOME ASSISTANCE";"ST-BARTH HOME ASSISTANCE";"répondre à des demandes non satisfaites visant l'amélioration de la vie quotidienne : les services aux personnes relevant de l'agrément qualité, les services aux personnes relevant de l'agrément simple ; assurer la viabilité du service par différentes formes de mixage des ressources publiques et privées ; organiser l'implication de tous les acteurs privés et sa solvalisation d'une part et construire une offre de qualité d'autre part";"021000";"000000";"";"";"";"";"Marigot Mont Jean";"_";"97701";"97133";"Saint-Barthélemy";"";"Marigot Mont Jean";"B.P 1347";"";"";"97133";"Saint-Barthélemy";"FRANCE";"PM";"";"0";"";"A";"2011-05-25 19:05:18"
"W9J1000031";"";"";"";"9J1T";"2011-05-02";"2011-07-28";"2011-05-21";"0001-01-01";"D";"S";"ARTMUZIK ST BART";"ARTMUZIK ST BART";"organiser et produire des spectacles d'artistes vivants ;
promouvoir des artistes : chanteurs, musiciens, danseurs, jongleurs, comédiens, poètes et peintres ; favoriser des rencontres entre les artistes invités et les jeunes en âge scolaire sur l'île de Saint-Barthélemy ; établir des partenariats avec des associations artistiques en dehors de l'île";"006100";"000000";"Domaine du levant";"";"";"";"Petit Cul de Sac";"_";"97701";"97133";"Saint-Barthélemy";"";"Domaine du levant";"";"Petit Cul de Sac";"";"97133";"Saint-Barthélemy";"FRANCE";"PF";"";"0";"";"A";"2011-08-01 14:54:30"
"W9J1000032";"08/09/1996";"";"";"9J1T";"1996-09-08";"2014-08-06";"1996-10-02";"2014-08-05";"D";"S";"ASSOCIATION DE GESTION DE LA RESERVE NATURELLE  DE SAINT-BARTHELEMY (GRENAT)";"ASSOCIATION GRENAT";"gérer la réserve naturelle de Saint-Barthélemy, protéger les sites naturels qui la composent, installer et effectuer la maintenance des équipements nécessaires, effectuer la gestion du personnel, informer le public et mettre en oeuvre toutes les dispositions règlementaires retenues par l'assemblée pour son fonctionnement, contrôler l'application du règlement intérieur, établir et gérer le budget, gérer d'autres sites naturels de Saint-Barthélemy et ses îlots ou mener des actions de sauvegarde et de réhabilitation des espèces animales et végétales sur tout le territoire";"024015";"000000";"B.P 683";"";"";"";"Gustavia";"_";"97701";"97133";"Saint-Barthélemy";"";"VILLA YUANA";"";"ANSE DES CAYES";"";"97133";"Saint-Barthélemy";"FRANCE";"PM";"";"1";"";"D";"2014-09-02 14:15:28"
"W9J1000033";"30/06/1986";"";"";"9J1T";"1986-06-30";"2022-06-24";"1986-08-06";"0001-01-01";"D";"S";"AMICALE DE L'ECOLE PRIMAIRE DE GUSTAVIA";"AMICALE DE L'ECOLE PRIMAIRE DE GUSTAV";"développer les relations entre les parents et les enseignants dans le cadre d'actions ou d'activités à caractères sociaux, éducatifs ou périscolaires (sorties, fêtes, loteries, etc) ; promouvoir et défendre le fonctionnement équilibré de l'école, dans le respect de chacun ; aider à l'acquisition d'équipements à usage pédagogique ou récréatif ; favoriser des actions communes entre les classes de l'école des TPS aux classes de CM2 ; permettre par des actions diverses une meilleure insertion des enfants dans leur cadre scolaire, ainsi que dans la société Saint-Barth et à l'international ; rechercher et discuter en commun toutes les améliorations désirables dans l'intérêt des élèves ; saisir l'administration des voeux émis à ce sujet ; poursuivre la réalisation par tous les moyens en son pouvoir ; faciliter le fonctionnement et l'organisation de la vie scolaire ; rester à l'écoute des parents d'élèves et les informer";"015075";"000000";"Ecole maternelle de Gustavia";"";"";"";"";"_";"97701";"97133";"Saint-Barthélemy";"";"Ecole maternelle de Gustavia";"";"";"";"97133";"Saint-Barthélemy";"FRANCE";"PF";"";"1";"";"A";"2022-07-12 12:45:35"
"W9J1000034";"15/03/2007";"";"";"9J1T";"2007-03-29";"2016-11-28";"1901-07-01";"2016-11-15";"D";"S";"ST-BARTH WINDSURFING CLUB";"ST-BARTH WINDSURFING CLUB";"pratiquer, enseignement et être le support à la compétition du windsurfing et des sports associés";"011185";"000000";"Grand cul de sac";"";"";"";"";"_";"97701";"97133";"Saint-Barthélemy";"";"B.P 1221";"";"";"";"97133";"Saint-Barthélemy";"FRANCE";"PM";"";"1";"";"D";"2016-11-28 21:28:48"
"W9J1000035";"";"";"";"9J1T";"2011-05-12";"2013-03-04";"2011-06-04";"0001-01-01";"D";"S";"SAINT-BARTH FUN CUP";"SAINT-BARTH FUN CUP";"rechercher des partenaires et organiser la course de planche à voile annuelle sur l'île de Saint-Barthélemy dénommée la Saint-Barth Fun Cup ou des manifestations sportives similaires";"011185";"000000";"Route du village";"";"";"";"Saint-Jean";"_";"97701";"97133";"Saint-Barthélemy";"";"Route du village";"";"Saint-Jean";"";"97133";"Saint-Barthélemy";"FRANCE";"PM";"";"0";"";"A";"2013-03-22 15:31:45"
"W9J1000036";"";"";"";"9J1T";"2011-06-15";"2011-06-15";"2011-07-09";"0001-01-01";"D";"S";"ST BARTS QUEENS";"ST BARTS QUEENS";"permettre de représenter l'île de Saint-Barthélemy au concours internationaux de beauté, travailler en relation avec les institutions publiques et privées de Saint-Barthélemy dans le but de promouvoir la mode, la beauté, l'identité et les valeurs de Saint-Barthélemy au-delà des frontières";"050000";"050000";"";"";"";"";"Merlette";"_";"97701";"97133";"Saint-Barthélemy";"";"Merlette";"";"";"";"97133";"Saint-Barthélemy";"FRANCE";"PF";"";"0";"";"A";"2011-07-18 20:39:17"
"W9J1000037";"";"";"";"9J1T";"2011-06-17";"2015-07-10";"2011-07-09";"0001-01-01";"D";"S";"ASSOCIATION DES ARTISANS TAXIS";"A.D.A.T.";"participer à la politique routière et à l'élaboration des textes régissant les activités de transport routier par une aide apportée à la collectivité d'Outre mer de SAINT BARTHELEMY ; former, informer et échanger dans les domaines du transport, de la circulation routière et du tourisme ; organiser la profession du transport terrestre de personnes ; défendre les intérêts de ses membres";"022543";"000000";"";"";"";"";"Colombier";"_";"97701";"97133";"Saint-Barthélemy";"";"";"CHEZ MME MAGRAS LILIANE";"COLOMBIER";"";"97133";"SAINT-BARTHéLEMY";"FRANCE";"PF";"";"0";"";"A";"2016-01-08 20:00:06"
"W9J1000038";"";"";"";"9J1T";"2011-07-22";"2011-07-22";"2011-08-06";"0001-01-01";"D";"S";"TO B.ART CENTER";"TO B.ART CENTER";"organiser des expositions d'oeuvres d'art existantes ou produites sur place, des évènements et des manifestations culturelles ainsi que la promotion et le soutien aux artistes locaux afin de mettre en valeur le patrimoine culturel et artistique de st barthélemy";"006000";"000000";"Anse des Lézards";"";"";"";"";"_";"97701";"97133";"Saint-Barthélemy";"";"Association TO B.ART CENTER";"Anse des Lézards";"B.P 382";"";"97097";"Saint-Barthélemy CEDEX";"FRANCE";"PM";"";"0";"";"A";"2011-08-08 17:07:36"
"W9J1000039";"";"";"";"9J1T";"2011-07-26";"2021-12-10";"2011-08-06";"0001-01-01";"D";"S";"LES VOILES AU FEMININ";"LES VOILES AU FEMININ";"regrouper des femmes ou jeunes filles désireuses de pratiquer la voile habitable ou sportive en plaisance ou en régate";"011185";"000000";"Villa Carambole";"";"";"";"Anse des Lézards";"_";"97701";"97133";"Saint-Barthélemy";"";"Villa Carambole";"";"Anse des Lézards";"";"97133";"Saint-Barthélemy";"FRANCE";"PF";"";"0";"";"A";"2021-12-15 16:22:32"
"W9J1000040";"";"";"";"9J1T";"2011-09-26";"2015-11-27";"2011-10-15";"0001-01-01";"D";"S";"ESPRIT ATHLE SAINT BARTH";"E. A. S. B.";"développer et contrôler la pratique par ses Membres de l'Athlétisme sous toutes ses formes dans le cadre de la délégation accordée par le Ministère chargé des Sports à la FFA et dans celui du développement durable ; participer à l'organisation de la course sur route de GUSTAVIALOPPET ; offrir à ses membres un loisir sportif et éducatif par l'apprentissage des activités liées à l'Athlétisme ; assurer la représentation de l'Athlétisme sur le plan local ; contribuer à l'animation sportif et culturel sur le territoire de SAINT BARTHELEMY";"011020";"000000";"";"";"";"";"Saint-Jean Carénage";"_";"97701";"97133";"Saint-Barthélemy";"";"";"";"Saint-Jean Carénage";"";"97133";"Saint-Barthélemy";"FRANCE";"PM";"";"0";"";"A";"2015-11-27 18:04:29"
"W9J1000041";"09/10/86";"";"";"9J1T";"1986-10-29";"2025-01-27";"1986-11-26";"0001-01-01";"D";"S";"BIBLIOTHEQUE ST JOSEPH";"BIBLIOTHEQUE ST JOSEPH";"gérer une bibliothèque à Lorient et promouvoir toutes activités à vocation culturelle";"006070";"000000";"";"";"";"";"Lorient";"_";"97701";"97133";"Saint-Barthélemy";"";"BIBLIOTHEQUE ST JOSEPH";"";"LORIENT";"";"97133";"SAINT-BARTHÉLEMY";"FRANCE";"PF";"";"1";"";"A";"2025-01-28 15:50:23"
"W9J1000042";"";"";"";"9J1T";"2011-11-07";"2017-08-09";"2011-11-19";"0001-01-01";"D";"S";"LES ZANDOLIS";"LES ZANDOLIS";"garder des enfants scolarisés en dehors des heures et périodes scolaires";"021005";"000000";"Ecole primaire de Gustavia";"";"";"";"Gustavia";"_";"97701";"97133";"Saint-Barthélemy";"";"ECOLE PRIMAIRE DE GUSTAVIA";"";"GUSTAVIA";"";"97133";"SAINT-BARTHéLEMY";"FRANCE";"PF";"";"0";"";"A";"2018-02-07 20:00:02"
"W9J1000043";"04:03:2002";"";"";"9J1T";"2002-03-04";"2011-11-14";"2002-04-06";"0001-01-01";"D";"S";"SAINT-BARTH ATHLETIC CLUB";"S.B.A.C.";"contribuer au développement de l'athlétisme à Saint-Barthélemy ; participer à l'organisation de la course sur route dénommée Gustavialoppet ; contribuer à l'animation sportive et culturelle dans la commune ; maintenir et resserer les liens entre ses membres en participant à des manifestations ou activités locales ; développer les liens d'amitié et de sportivité avec nos amis suédois";"011020";"000000";"chez M. PERRON D'ARC Patrick";"";"";"";"Gustavia";"BP 236_";"97701";"97133";"Saint-Barthélemy";"";"";"";"Gustavia";"BP 236";"97133";"Saint-Barthélemy";"FRANCE";"PM";"";"1";"";"A";"2011-11-23 17:01:23"
"W9J1000044";"";"";"";"9J1T";"2011-11-28";"2023-11-24";"2011-12-10";"0001-01-01";"D";"S";"LES AMIS DE LA SUDERMANIE";"LES AMIS DE LA SUDERMANIE";"organiser des réunions culturelles et philosophiques entre ses membres ; installer et entretenir tous locaux destinés à cet usage ; favoriser les relations entre les groupements partageant les mêmes objectifs";"006000";"000000";"Villa Haïku";"";"";"";"St Jean Plantations";"BP 363_";"97701";"97133";"Saint-Barthélemy";"";"Villa Haïku";"";"St Jean Plantations";"BP 363";"97133";"Saint-Barthélemy";"FRANCE";"PM";"";"0";"";"A";"2023-11-28 18:10:16"
"W9J1000045";"";"";"";"9J1T";"2011-12-09";"2013-02-20";"2011-12-31";"0001-01-01";"D";"S";"CONFEDERATION NATIONALE DE DANSE ILE DE SAINT-BARTHELEMY";"CNDSBH";"promouvoir, soutenir, développer l'enseignement, la création, la diffusion et la pratique de la danse sous toutes ses formes ; développer des partenariats avec les collectivités territoriales, les institutions locales et régionales ; prendre en considération le métier de professeur de danse, protéger et défendre les intérêts des danseurs amateurs et professionnels ; assurer des actions régulières auprès du public et des adhérents par l'organisation de colloques, de stages, de spectacles ; vendre des articles portant le logo de la Confédération Nationale de Danse Région Ile de Saint-Barthélemy";"006000";"000000";"Grand Fond";"";"";"";"";"_";"97701";"97133";"Saint-Barthélemy";"";"Grand Fond";"";"";"";"97133";"Saint-Barthélemy";"FRANCE";"PF";"";"0";"";"A";"2013-02-28 20:43:04"
"W9J1000046";"";"";"";"9J1T";"2012-01-23";"2012-01-23";"2012-02-18";"0001-01-01";"D";"S";"ST BARTH REIKI HARMONIE";"ST BARTH REIKI HARMONIE";"partager et prendre connaissances de soin énergétique, de massage, de bien-être à la personne, par le biais d'actions, d'organisation de stages, d'évènements, de divers ateliers de formation et d'information";"017135";"000000";"Grand cul de sac";"";"";"";"";"_";"97701";"97133";"Saint-Barthélemy";"";"";"Grand cul de sac";"";"B.P 580";"97133";"Saint-Barthélemy";"FRANCE";"PF";"";"0";"";"A";"2012-02-23 17:35:10"
"W9J1000047";"";"";"";"9J1T";"2012-02-08";"2024-03-18";"2012-02-25";"0001-01-01";"D";"S";"GROUPE FOLKLORIQUE FRANCO PORTUGAIS DE SAINT-BARTHELEMY";"G.F.F.P.S.B.";"faire découvrir les chants, danses, musiques, coutumes et traditions de notre pays au habitants de l'île de Saint-Barthélemy sous forme de cours de danse folklorique, manifestations";"006040";"006030";"";"";"";"";"Salines";"_";"97701";"97133";"Saint-Barthélemy";"";"chez Charles LAPLACE";"";"Salines";"";"97133";"Saint-Barthélemy";"FRANCE";"PF";"";"0";"";"A";"2024-03-18 19:58:48"
"W9J1000048";"";"";"";"9J1T";"2012-03-06";"2012-03-06";"2012-03-24";"0001-01-01";"D";"S";"USEP ST BARTH";"USEP ST BARTH";"contribuer à la formation du jeune citoyen par le développement de la responsabilité, du civisme, de l'autonomie au travers de la pratique d'activités physiques, sportives, d'activités socioculturelles ; contribuer à l'éducation globale des enfants";"009015";"011000";"Ecole primaire";"";"";"";"Gustavia";"_";"97701";"97133";"Saint-Barthélemy";"";"Ecole primaire";"rue de l'Eglise";"Gustavia";"";"97133";"Saint-Barthélemy";"FRANCE";"PM";"";"0";"";"A";"2012-03-24 18:45:43"
"W9J1000049";"";"";"";"9J1T";"2012-03-27";"2012-03-27";"2012-04-07";"0001-01-01";"D";"S";"ST BARTH LANGUAGE CAFE";"ST BARTH LANGUAGE CAFE";"promouvoir l'apprentissage des langues étrangères à St Barthélemy par la rencontre de personnes de nationalités différentes et désireuses de pratiquer une langue étrangère par l'intermédiaire d'évènements et d'actions";"006110";"000000";"";"";"";"";"Colombier";"_";"97701";"97133";"Saint-Barthélemy";"";"";"";"Colombier";"";"97133";"Saint-Barthélemy";"FRANCE";"PL";"";"0";"";"A";"2012-04-07 12:46:06"
"W9J1000050";"";"";"";"9J1T";"2012-04-25";"2012-04-25";"2012-05-19";"0001-01-01";"D";"S";"WINE TASTERS OF ST BARTH";"WINE TASTERS OF ST BARTH";"développer des activités culturelles liées à la découverte des vignobles et des terroirs de qualité du monde entier";"007060";"000000";"Tom Beach Hôtel";"";"";"";"Saint-Jean";"_";"97701";"97133";"Saint-Barthélemy";"";"Tom Beach Hôtel";"";"Saint-Jean";"";"97133";"Saint-Barthélemy";"FRANCE";"PM";"";"0";"";"A";"2012-05-19 12:45:28"
"W9J1000051";"19/02/1997";"";"";"9J1T";"1997-02-19";"2023-02-14";"1997-03-26";"0001-01-01";"D";"S";"FESTIVAL DE MUSIQUE DE SAINT-BARTHELEMY FRANCES DE BROFF";"FESTIVAL DE MUSIQUE DE SAINT-BARTHE...";"développer la pratique de la musique notamment en organisant des concerts, des spectacles de danse, des cours publics, des auditions en donnant des bourses ou en aidant des jeunes gens à obtenir des bourses qui leur permettent de développer leur éducation musicale et artistique";"006030";"000000";"Grand Fond";"";"";"IMM";"Chez Corinne Hennequin";"_";"97701";"97133";"Saint-Barthélemy";"";"CHEZ MME CORINNE HENNEQUIN";"GRAND FOND";"";"";"97133";"SAINT-BARTHéLEMY";"FRANCE";"PF";"";"1";"";"A";"2023-03-15 13:06:41"
"W9J1000052";"";"";"";"9J1T";"2012-05-11";"2012-05-11";"2012-05-26";"0001-01-01";"D";"S";"LA PERLE DE SAINT BARTHELEMY";"LA PERLE";"promouvoir les actions de formation aux métiers de l'hôtellerie sur le territoire de la collectivité de Saint-Barthélemy";"023040";"000000";"Gustavia";"48";"";"RUE";"de la paix";"_";"97701";"97133";"Saint-Barthélemy";"";"Gustavia";"";"48  rue DE LA  PAIX";"";"97133";"Saint-Barthélemy";"FRANCE";"PL";"";"0";"";"A";"2012-05-29 14:51:28"
"W9J1000053";"";"";"";"9J1T";"2012-05-29";"2025-04-15";"2012-06-09";"2025-04-11";"D";"S";"UN ESPOIR POUR LOUCAS";"UN ESPOIR POUR LOUCAS";"collecter des fonds auprès du public, des entreprises, des fondations et des collectivités françaises afin de financer l'ensemble des frais afférents à l'intervention chirurgicale dénommée ""myoténofasciotomie"" actuellement pratiquée en Espagne, assurer le suivi post-opératoire dans un centre spécialisé aux Etats-Unis pour l'enfant Loucas MOREIRA BERNARDO atteint d'une infirmité motrice cérabrale dûe à une grande prématurité";"017000";"000000";"";"";"";"";"Vitet";"_";"97701";"97133";"Saint-Barthélemy";"";"";"";"VITET";"";"97133";"Saint-Barthélemy";"FRANCE";"PF";"";"0";"";"D";"2025-04-15 18:14:39"
"W9J1000054";"";"";"";"9J1T";"2012-05-21";"2012-05-21";"2012-06-09";"0001-01-01";"D";"S";"SOS CARAPACE";"SOS CARAPACE";"sauvegarder les tortues de terre de l'île de Saint-Barthélemy";"024026";"000000";"";"";"";"";"Lurin";"_";"97701";"97133";"Saint-Barthélemy";"";"";"";"Lurin";"";"97133";"Saint-Barthélemy";"FRANCE";"PF";"";"0";"";"A";"2012-06-09 12:45:19"
"W9J1000055";"";"";"";"9J1T";"2012-05-25";"2015-09-18";"2012-06-09";"2015-08-07";"D";"S";"OUANALAO FOOTBALL CLUB";"O.F.C.";"pratiquer le football";"011075";"000000";"lot la plantation";"";"";"";"Saint-Jean";"_";"97701";"97133";"Saint-Barthélemy";"";"LOT LA PLANTATION";"";"SAINT-JEAN";"";"97133";"Saint-Barthélemy";"FRANCE";"PM";"";"0";"";"D";"2015-09-21 14:25:44"
"W9J1000056";"20/11/2002";"";"";"9J1T";"2002-11-20";"2017-11-17";"2003-02-15";"0001-01-01";"D";"S";"ASSOCIATION PLONGEE CARAIBES";"ASSOCIATION PLONGEE CARAIBES";"pratiquer et enseigner la plongée sous-marine du débutant au monitorat et ses activités annexes : nage avec palme en mer ou en milieu artificiel ; apnée en mer ou en milieu artificiel ; toutes activités mettant en jeu des techniques utilisées en plongée sous-marine ; initiation de la plongée auprès des enfants";"011125";"000000";"Apt 3 maison Clébert QUESTEL";"";"";"";"Anse des Cayes";"_";"97701";"97133";"Saint-Barthélemy";"";"B.P 1028";"";"ST JEAN";"";"97133";"SAINT-BARTHéLEMY";"FRANCE";"PM";"";"1";"";"A";"2017-12-09 12:45:40"
"W9J1000057";"";"";"";"9J1T";"2012-07-18";"2013-10-02";"2012-07-28";"0001-01-01";"D";"S";"SAINT-BARTH JUJITSU";"SAINT-BARTH JUJITSU";"rassembler les pratiquants de Ju-Jitsu traditionnel, judo, taiso, self défense";"011140";"011150";"";"";"";"";"";"_COLOMBIER";"97701";"97133";"Saint-Barthélemy";"";"";"";"COLOMBIER";"";"97133";"Saint-Barthélemy";"FRANCE";"PM";"";"0";"";"A";"2013-10-03 20:18:04"
"W9J1000058";"";"";"";"9J1T";"2012-09-06";"2012-09-06";"2012-09-29";"0001-01-01";"D";"S";"TRAIL ST BARTH TEAM";"TRAIL ST BARTH TEAM";"pratiquer le trail, les courses de montagne, les randonnées sportives et de loisirs";"011020";"011115";"";"31";"";"LOT";"Pointe Milou";"_";"97701";"97133";"Saint-Barthélemy";"";"";"";"31  lotissement Pointe Milou";"";"97133";"Saint-Barthélemy";"FRANCE";"PM";"";"0";"";"A";"2012-09-29 12:45:16"
"W9J1000059";"";"";"";"9J1T";"2012-09-26";"2013-11-20";"2012-10-13";"2013-11-18";"D";"S";"AI KI KON GEN";"A.K.K.G.";"transmettre les moyens d'harmonisation des forces physiques et philosophiques par les arts martiaux, AIKIDO et autres Arts Martiaux";"040000";"000000";"Saline";"";"";"";"";"_";"97701";"97133";"Saint-Barthélemy";"";"le tamarin";"";"route de saline";"";"97133";"Saint-Barthélemy";"FRANCE";"PL";"";"0";"";"D";"2013-12-03 20:19:44"
"W9J1000060";"";"";"";"9J1T";"2012-10-23";"2012-10-23";"2012-11-03";"0001-01-01";"D";"S";"SHOWBIZHARMONY";"SHOWBIZHARMONY";"créer, réaliser et produire des spectacles vivants ainsi que toutes manifestations artistiques, culturelle, sportives et de loisirs dans un cadre de diffusion le plus large possible, pour tout public, faisant intervenir des artistes professionnels ou non, bénévoles ou non et de tout âge ; organiser le planning de la salle louée par l'association afin de promouvoir toutes activités permettant l'insertion, l'épanouissement et l'entretien physique de ses adhérents en partenariat ou non avec d'autres associations ; faire appel à des professionnels du spectacle ainsi qu'à des professionnels des métiers de la forme, rémunérés ou bénévoles qui pourront disposer de son local contre rémunération ou non";"006100";"011192";"";"";"";"";"Corossol";"_";"97701";"97133";"Saint-Barthélemy";"";"";"";"Corossol";"";"97133";"Saint-Barthélemy";"FRANCE";"PL";"";"0";"";"A";"2012-11-03 12:46:12"
"W9J1000061";"";"";"";"9J1T";"2012-11-14";"2016-12-13";"2012-11-24";"2016-12-13";"D";"S";"M.A.M. TENDR'EVEIL";"M.A.M. TENDR'EVEIL";"accueillir collectivement de jeunes enfants ; promouvoir toute action contribuant au bien des enfants et des parents en écoutant, conseillant et soutenant les familles ; proposer aux enfants des animations visant l'apprentissage de valeurs morales et civiques";"021005";"000000";"";"";"";"";"Colombier";"_";"97701";"97133";"Saint-Barthélemy";"";"Chez M. Christian TURBE";"";"Colombier";"";"97133";"Saint-Barthélemy";"FRANCE";"PF";"";"0";"";"D";"2016-12-13 21:28:26"
"W9J1000062";"14/08/2007";"";"";"9J1T";"2007-08-14";"2019-06-03";"2007-09-08";"0001-01-01";"D";"S";"SAINT BARTH TENNIS CLUB";"SAINT BARTH TENNIS CLUB";"pratiquer le tennis et participer à l'épanouissement de la jeunesse";"011165";"000000";"La plaine des jeux";"";"";"";"Saint-Jean";"_";"97701";"97133";"Saint-Barthélemy";"";"La plaine des jeux";"";"Saint-Jean";"";"97133";"Saint-Barthélemy";"FRANCE";"PM";"";"1";"";"A";"2019-06-06 18:31:04"
"W9J1000063";"";"";"";"9J1T";"2012-12-03";"2013-09-05";"2012-12-22";"0001-01-01";"D";"S";"EGLISE ANGLICANE DE SAINT-BARTHELEMY";"EGLISE ANGLICANE DE SAINT-BARTHELEMY";"assurer la célébration du culte anglican et pouvoir en tout ou partie aux frais et besoins de ce culte";"040000";"000000";"Gustavia";"";"";"RUE";"Samuel Fahlberg";"_";"97701";"97133";"Saint-Barthélemy";"";"Gustavia";"";"rue Saint-Thomas";"";"97133";"Saint-Barthélemy";"FRANCE";"PM";"";"0";"";"A";"2013-09-16 14:50:29"
"W9J1000064";"";"";"";"9J1T";"2012-12-18";"2012-12-18";"2013-01-26";"0001-01-01";"D";"S";"ADVENTURE CLUB ST BARTH";"ADVENTURE CLUB ST BARTH";"initier, gérer, enseigner le sport tel que stand up paddle, surf, bodyboard, kick boxing, boxe américaine et la culture ; organiser tous types de manifestations culturelles et sportives visant à favoriser le développement et l'expansion de la culture et du sport";"011005";"000000";"";"";"";"";"";"_";"97701";"97133";"Saint-Barthélemy";"";"chez RAMETTE Pascal";"anse des lézards";"";"";"97133";"Saint-Barthélemy";"FRANCE";"PM";"";"0";"";"A";"2013-01-26 12:45:13"
"W9J1000065";"";"";"";"9J1T";"2013-01-11";"2014-08-08";"2013-01-26";"0001-01-01";"D";"S";"HAPPY FEET";"HAPPY FEET";"promouvoir et développer la pratique des danses en couple et danses en ligne à St Barthélemy";"006040";"000000";"Gustavia";"6";"";"RUE";"de la république";"_";"97701";"97133";"Saint-Barthélemy";"";"Gustavia";"";"";"B.P 336";"97096";"Saint-Barthélemy CEDEX";"FRANCE";"PM";"";"0";"";"A";"2014-09-02 20:52:11"
"W9J1000066";"";"";"";"9J1T";"2013-01-31";"2015-06-16";"2013-02-09";"0001-01-01";"D";"S";"SENZALA OUANALAO CAPOEIRA";"S.O.C.A";"permettre l'initiation, la découverte, l'apprentissage, le perfectionnement et l'approche de la philosophie inculquée par la culture afro-brésilienne ou caribéenne tant dans le domaine sportif, musical, culinaire ou toutes autres activités s'y rapportant";"006000";"011000";"Villa Turtle";"";"";"";"Corossol";"_";"97701";"97133";"Saint-Barthélemy";"";"LES MANGLIERS";"";"SAINT-JEAN";"BP1322";"97133";"SAINT-BARTHéLEMY";"FRANCE";"PM";"";"0";"";"A";"2015-12-15 20:00:04"
"W9J1000067";"06/08/2008";"";"";"173P";"2008-08-06";"2015-04-23";"2008-09-13";"0001-01-01";"D";"S";"ASSOCIATION DU CH'AN EUROPE";"ADCE";"faire connaître et promouvoir la tradition du Ch'an et ses application dans les techniques de méditation, de psychologie, favoriser les échanges entre les usagers du Ch'an";"040000";"000000";"";"1";"";"RUE";"de la Béarnoise";"";"17300";"17000";"Rochelle";"";"";"";"Les hauts de Saint-Jean";"";"97133";"Saint-Barthélemy";"FRANCE";"PM";"";"1";"";"A";"2015-10-23 20:00:04"
"W9J1000068";"";"";"";"9J1T";"2013-02-20";"2015-05-28";"2013-03-09";"0001-01-01";"D";"S";"ST BARTH ILE D'ART";"SBIA";"concevoir, organiser et promouvoir la tenue et le développement de manifestations culturelles et artistiques à Saint-Barthélemy ; faire découvrir et faire reconnaître nationalement et internationalement le patrimoine et le potentiel artistique de Saint-Barthélemy ; contribuer à soutenir la collectivité de Saint-Barthélemy et son comité du tourisme pour promouvoir l'identité culturelle de Saint-Barthélemy et son patrimoine historique et artistique ; éditer des livres sur l'art sous toutes ses formes ; offrir aux artistes de Saint-Barthélemy ainsi qu'aux artistes de passage des lieux d'exposition et d'organisation de manifesttations culturelles";"006000";"000000";"Gustavia";"4";"";"RUE";"Général de Gaulle";"_";"97701";"97133";"Saint-Barthélemy";"";"GUSTAVIA";"";"4 RUE GéNéRAL DE GAULLE";"";"97133";"SAINT-BARTHéLEMY";"FRANCE";"PF";"";"0";"";"A";"2015-11-26 20:00:02"
"W9J1000069";"";"";"";"721S";"2013-03-22";"2017-10-09";"2013-04-13";"0001-01-01";"D";"S";"DROITURE EN PAYS FLÉCHOIS";"DROITURE";"promouvoir la démocratie directe à l'échelle locale par la mise en place d'expériences d'externalisation sur le terrain, par le biais notamment des plateformes de « crowdsourcing » et des plateformes collaboratives d'« editing », ainsi que les principes de probité, de loyauté et de respect des engagements pris devant la population, dans la perspective notamment des prochaines échéances électorales locales ;";"001020";"000000";"";"2";"";"BD";"DE MONTREAL";"";"72154";"72200";"Flèche";"";"";"";"B.P 70";"";"97095";"Saint-Barthélemy Cédex";"FRANCE";"PM";"";"0";"";"A";"2018-04-10 20:00:02"
"W9J1000070";"";"";"";"9J1T";"2013-04-08";"2013-04-08";"2013-04-20";"0001-01-01";"D";"S";"LOUEURS DE VOITURES AYANT LEUR POINT DE VENTE A L'AEROPORT DE SAINT-BARTHELEMY";"LOUEURS DE VOITURES AYANT LEUR POIN...";"étudier et défendre les droits ainsi que les intérêts matériels et moraux tant collectifs qu'individuels des loueurs de voitures ayant leur point de vente à l'aéroport de Saint-Jean - SAINT-BARTHELEMY";"022530";"023040";"";"";"";"";"Anse des Cayes";"_";"97701";"97133";"Saint-Barthélemy";"";"";"";"Anse des Cayes";"";"97133";"Saint-Barthélemy";"FRANCE";"PM";"";"0";"";"A";"2013-04-20 12:45:52"
"W9J1000071";"13/03/2003";"";"";"9J1T";"2003-03-13";"2015-12-02";"2003-05-03";"2015-05-14";"D";"S";"CLUB UNESCO SAINT-BARTHELEMY CARAIBES";"CLUB UNESCO SAINT-BARTHELEMY CARAIBES";"contribuer à une meilleure compréhension internationale et interculturelle conformément aux principes et idéaux de l'Unesco et intéresser ses membres et l'opinion publique aux problèmes que l'Unesco s'efforce de résoudre dans le monde";"002020";"000000";"Hôtel de ville";"";"";"";"gustavia";"_";"97701";"97133";"Saint-Barthélemy";"";"";"";"";"B.P 566";"97133";"Saint-Barthélemy";"FRANCE";"PM";"";"1";"";"D";"2015-12-02 16:39:16"
"W9J1000072";"";"";"";"9J1T";"2013-04-23";"2013-04-23";"2013-05-04";"0001-01-01";"D";"S";"ASSOCIATION NATIONALE DE FINANCEMENT DE DROITURE";"A.N.F.D.";"recueillir les fonds destinés au seul financement du parti Droiture, conformément aux dispositions de l'article 11-1 de la loi n° 88-227 du 11 mars 1988, modifiée, relative à la transparence financière de la vie politique";"001010";"000000";"La Soleillade";"";"";"LD";"Grand cul de sac";"_";"97701";"97133";"Saint-Barthélemy";"";"DROITURE";"";"";"B.P 70";"97095";"Saint-Barthélemy Cédex";"FRANCE";"PM";"";"0";"";"A";"2013-05-07 20:32:47"
"W9J1000073";"";"";"";"9J1T";"2013-05-14";"2024-11-26";"2013-06-08";"0001-01-01";"D";"S";"LA POINTE EN MOUVEMENT";"L.P.M.";"faire découvrir, initier et apprendre la culture caribéenne en général à travers le carnaval (tambours à peau, rythmes musicaux, confection de costumes, etc..), la musique (Gwo Ka, percussions, etc...), la réalisation d'instruments musicaux (tambours, chachas, coques à lambi, etc...), le chant, la langue créole, ainsi que toutes autres activités s'y rapportant de près ou de loin";"006030";"006090";"";"12";"";"RUE";"de la paix";"_gustavia";"97701";"97133";"Saint-Barthélemy";"";"28 Rue Irénée de Bruyn";"";"Gustavia";"";"97133";"Saint-Barthélemy";"FRANCE";"PM";"";"0";"";"A";"2024-12-02 20:42:53"
"W9J1000074";"";"";"";"9J1T";"2013-08-07";"2020-01-10";"2013-08-31";"0001-01-01";"D";"S";"FLEUR AUSTRALE EXPEDITIONS";"FLEUR AUSTRALE EXPEDITIONS";"connaître et sauvegarder les océans ; effectuer des prélèvements d'eau de mer pour la salinité et la température ; effectuer tout type de prélèvement pour la connaissance du milieu ; filmer en sous-marin pour l'étude des déchets flottants ; effectuer des relevés météo ; filmer, photographier le monde animal ; filmer, photographier les activités, associations, liées au monde maritime, pour son exploitation et sa sauvegarde";"024010";"000000";"";"";"";"";"Dévé";"_";"97701";"97133";"Saint-Barthélemy";"";"";"";"Dévé";"B.P 439";"97097";"Saint-Barthélemy";"FRANCE";"PM";"";"0";"";"A";"2020-01-14 14:57:21"
"W9J1000075";"";"";"";"9J1T";"2013-08-19";"2013-08-19";"2013-08-31";"0001-01-01";"D";"S";"EN TOUTE FRANCHISE ILE DE SAINT-BARTHELEMY";"EN TOUTE FRANCHISE ILE DE SAINT-BAR...";"promouvoir un développement économique harmonieux et durable de l'île de saint-barthélemy fondé sur la liberté d'entreprendre et l'équilibre social ; représenter les franchisés, ex-franchisés et les commerçants indépendants devant les pouvoirs publics, défendre leurs droits et leurs intérêts ; faire respecter les textes légaux et réglementaires ; assurer par tous moyens légaux la promotion de la profession de commerçant indépendant et de l'artisan sous toutes leurs formes et d'agir pour le développement de la liberté d'entreprendre, fondement des activités commerciales et artisanales dans le cadre d'actions devant les juridictions judiciaires, administratives, pénales concernant les décisions territoriales d'aménagement commercial ou nationales relatives à l'île de saint-barthélemy";"023025";"023007";"";"";"";"";"Colombier";"_";"97701";"97133";"Saint-Barthélemy";"";"";"";"";"B.P 38";"97098";"Saint-Barthélemy";"FRANCE";"PF";"";"0";"";"A";"2013-08-31 12:45:42"
"W9J1000076";"12/11/2004";"";"";"9J1T";"2004-11-12";"2021-10-14";"2004-12-25";"0001-01-01";"D";"S";"SAINT-BARTH ENVIRONNEMENT ET DEVELOPPEMENT DURABLE";"SAINT-BARTH ENVIRONNEMENT ET DEVELO...";"participer à la préservation et à la valorisation de l'environnement de Saint-Barthélemy ; contribuer au développement durable de Saint-Barthélemy";"024050";"000000";"Gustavia";"";"";"RUE";"de la République";"_";"97701";"97133";"Saint-Barthélemy";"";"Gustavia";"";"rue de la République";"B.P 59";"97133";"Saint-Barthélemy";"FRANCE";"PM";"www.saintbarthenvironnement.com";"1";"";"A";"2021-11-18 19:24:46"
"W9J1000077";"";"";"";"9J1T";"2013-08-23";"2013-08-23";"2013-09-07";"0001-01-01";"D";"S";"ART SAINT BARTH";"ART SAINT BARTH";"promouvoir l'art sous toutes ses formes ; accompagner les artistes dans une volonté forte de partage, de création, d'échanges et de rencontres";"006100";"000000";"";"";"";"";"Grand Cul de Sac";"_";"97701";"97133";"Saint-Barthélemy";"";"villa Phare Caraïbes";"";"Grand Cul de Sac";"";"97133";"Saint-Barthélemy";"FRANCE";"PM";"";"0";"";"A";"2013-09-07 12:45:29"
"W9J1000078";"";"";"";"9J1T";"2013-08-27";"2013-08-27";"2013-09-14";"0001-01-01";"D";"S";"OBSERVATOIRE DU TRANSPORT AERIEN ET MARITIME";"OBSERVATOIRE DU TRANSPORT";"favoriser l'échange entre acteurs du transport aérien et maritime dans le but de contribuer à l'amélioration de la sécurité, de la sûreté et du confort des acteurs et usagers";"023045";"000000";"";"";"";"";"Anse des Cayes";"_";"97701";"97133";"Saint-Barthélemy";"";"";"";"Anse des Cayes";"";"97133";"Saint-Barthélemy";"FRANCE";"PM";"";"0";"";"A";"2013-09-14 12:45:27"
"W9J1000079";"";"";"";"9J1T";"2013-09-02";"2013-09-02";"2013-09-21";"0001-01-01";"D";"S";"ASSOCIATION REPRESENTATIVE DES PROFESSIONNELS DE LA PISCINE";"ARPP";"défendre les intérêts individuels et collectifs des commerçants, artisans dans le domaine du nettoyage et entretien piscine à Saint-Barthélemy (97133), établir un dialogue entre les professionnels de la piscine, la commune et les autorités administratives et judiciaires";"023007";"000000";"";"";"";"";"Terre-Neuve";"_";"97701";"97133";"Saint-Barthélemy";"";"";"";"Terre-Neuve";"";"97133";"Saint-Barthélemy";"FRANCE";"PM";"";"0";"";"A";"2013-09-24 18:45:23"
"W9J1000080";"";"";"";"9J1T";"2013-09-13";"2013-09-13";"2013-09-28";"0001-01-01";"D";"S";"SAINT-BARTH HERITAGE";"SAINT-BARTH HERITAGE";"faire reconnaitre le patrimoine existant de l'île de saint-barthélemy, faire prendre conscience des avantages que la discipline peut apporter au développement du territoire, faire comprendre et faire reconnaitre le statut singulier de certains éléments patrimoniaux en sensibilisant les habitants de l'île sur la valeur historique, culturelle et artistique du patrimoine de Saint-Barthélemy ; réunir, collecter, classifier toute information pouvant contribuer à la connaissance des éléments matériels, immatériels, culturels, historiques, constituant le patrimoine de l'île ; constituer des synthèses et des rapports historiques et techniques pour étudier et apporter une contribution scientifique sur des thèmes définis ; entretenir la mémoire de tout fait culturel, social, historique ou autre, ayant caractérisé ou marqué la vie de l'île ;  préserver, protéger, conserver, entretenir et restaurer les biens culturels; promouvoir des actions physiques sur les collections ; développer en liaison avec la collectivité et les acteurs locaux toutes les actions susceptibles de favoriser la valorisation de ce patrimoine ; former par ses propres moyens ou avec l'aide de ses adhérents ou à travers des bourses d'études et de stages aux techniques et savoir-faire liés à la conservation et la valorisation du patrimoine, mais aussi promouvoir un haut niveau de formation, de recherche et de pratique dans le domaine de l'étude, de la conservation, de la valorisation du patrimoine en accord avec les principes énoncés dans ces présents statuts et les textes législatifs et règlementaires en vigueur ; faciliter ces actions en partenariats avec d'autres organismes et encourager l'association de toute personne physique ou morale oeuvrant en faveur du patrimoine de l'île";"010020";"000000";"";"13";"";"RUE";"Jeanne d'Arc Gustavia";"_";"97701";"97133";"Saint-Barthélemy";"";"immeuble BNP";"rue du bord de mer";"gustavia";"";"97133";"Saint-Barthélemy";"FRANCE";"PF";"";"0";"";"A";"2013-10-03 20:10:31"
"W9J1000081";"10/11/2008";"";"";"9J1T";"2008-11-10";"2025-01-29";"2008-12-06";"0001-01-01";"D";"S";"COMITE DU CARNAVAL DE SAINT-BARTHELEMY";"KOKABARTH";"faire connaître le carnaval de saint-barthélemy localement et en dehors de saint-barthélemy ; développer toutes les actions susceptibles de faire évoluer les pratiques du carnaval et les intégrer aux domaines économiques, touristiques, artistiques et éducatifs ; contribuer au rapprochement des associations et acteurs du carnaval en vue d'une démarche commune d'évolution ; se faire le porte-parole des demandes, besoins et revendications des adhérents et acteurs du carnaval ; constituer un lieu d'échange et de propositions au service du carnaval ; contribuer à la reconnaissance et l'authenticité des pratiques des acteurs du carnaval ; établir un protocole d'accord proposant un code de conduite des carnavaliers de saint-barthélemy";"006115";"000000";"";"";"";"";"Grand cul de sac";"_";"97701";"97133";"Saint-Barthélemy";"";"MAISON BLEUE";"FLAMANDS";"";"";"97133";"SAINT-BARTHéLEMY";"FRANCE";"PF";"";"1";"";"A";"2025-01-31 19:54:05"
"W9J1000082";"";"";"";"9J1T";"2013-09-26";"2015-04-21";"2013-10-05";"0001-01-01";"D";"S";"CÔTÉ SCÈNE SBH";"CÔTÉ SCÈNE SBH";"favoriser, diffuser et réaliser des initiatives susceptibles de promouvoir et valoriser : la promotion et la diffusion de la culture sous toutes ses formes, de l'art dramatique, cinématographique, musical, chorégraphique, littéraire ; organiser et réaliser également pour le compte de tiers des manifestations, expositions, festivals et concours nationaux et internationaux ; développer des échanges culturels dans les domaines cités ci-dessus ; réaliser des initiatives publicitaires dans les secteurs de la culture ; créer, promouvoir et dérouler des activités didactiques susceptibles de gérer des cours de formation professionnelle à l'art dramatique ou tout autre activité culturelle dans le domaine de la culture, grâce à l'organisation de cours, séminaires, workshops, expositions, soirées, concours, etc.. ; éditer et distribuer des revues et bulletins en utilisant les moyens et procédés techniques les plus adaptés à leur diffusion ; collaborer avec des organismes publics et privés";"006100";"000000";"";"";"";"";"Saint-Jean L'étoile";"_";"97701";"97133";"Saint-Barthélemy";"";"";"";"ST JEAN";"B.P 1105";"97012";"SAINT-BARTHéLEMY";"FRANCE";"PF";"";"0";"";"A";"2015-10-21 20:00:07"
"W9J1000083";"";"";"";"9J1T";"2013-10-16";"2021-02-10";"2013-12-14";"0001-01-01";"D";"S";"SBH SUB LOISIRS SPORTIFS";"SBH SUB LOISIRS SPORTIFS";"pratiquer des activités physiques et sportives notamment celles permettant la découverte du milieu naturel marin et terrestre ; contribuer à la conservation de la faune, de la flore et des espaces naturels";"011400";"000000";"";"";"";"RUE";"PUBLIC";"_";"97701";"97133";"Saint-Barthélemy";"";"COLLèGE MIREILLE CHOISY";"";"";"B.P 58";"97133";"SAINT-BARTHéLEMY CEDEX";"FRANCE";"PM";"";"0";"";"A";"2021-08-12 20:00:03"
"W9J1000084";"";"";"";"9J1T";"2014-01-06";"2014-01-06";"2014-02-15";"0001-01-01";"D";"S";"ST BARTH LES SOURIRES DU TEMPS";"SBST";"créer et gérer un accueil de jour pour personnes âgées dans le but est d'améliorer leur qualité de vie et de permettre un moment de répit aux aidants";"021015";"000000";"";"";"";"RTE";"de la plage";"_Public";"97701";"97133";"Saint-Barthélemy";"";"";"";"route de la plage";"Public";"97133";"Saint-Barthélemy";"FRANCE";"PM";"";"0";"";"A";"2014-03-07 12:54:22"
"W9J1000085";"";"";"";"9J1T";"2014-02-20";"2014-02-20";"2014-04-12";"0001-01-01";"D";"S";"ENSEMBLE 97 SAINT BARTHELEMY CONSTRUISONS VOTRE AVENIR";"ENSEMBLE 97 SAINT BARTHELEMY CONSTR...";"apporter la prévention, l'aide, l'assistance, la médiation, la formation, le suivi et les contrôles économiques, financiers et sociaux aux personnes physiques en difficultés fiancières, voir en surrendettement, pour causes multiples et diverses sur l'ensemble de la collectivité territoriale de Saint-Barthélemy (97)";"002005";"000000";"";"";"";"";"Sea Horse Baie de Marigot";"_";"97701";"97133";"Saint-Barthélemy";"";"Co/ sxm copieur";"Marigot";"Rue de la Hollande";"";"97150";"Saint-Martin";"FRANCE";"PM";"";"0";"";"A";"2014-04-12 12:45:09"
"W9J1000086";"30/01/2000";"";"";"9J1T";"2000-01-30";"2023-01-04";"2000-04-01";"2018-02-23";"D";"S";"ASSOCIATION LOCALE POUR LE CULTE DES TEMOINS DE JEHOVAH DE SAINT-BARTHELEMY";"ASSOCIATION LOCALE POUR LE CULTE DE...";"subvenir aux frais, à l'entretien et à l'exercice public du culte des témoins de jéhovah, apporter son aide et son assistance à toute association poursuivant un objet identique, acquérir, louer ou construire les terrains et les immeubles pouvant servir aux buts qu'elle s'est fixée et, d'une manière générale, réaliser toute transaction mobilière ou immobilière en vue de l'exercice public du culte des témoins de jéhovah";"040000";"000000";"Saint-Jean Carénage";"";"";"";"";"_";"97701";"97133";"Saint-Barthélemy";"";"COLOMBIER";"";"";"";"97133";"SAINT-BARTHéLEMY";"FRANCE";"PM";"";"1";"";"D";"2023-02-14 12:45:38"
"W9J1000087";"";"";"";"9J1T";"2014-05-16";"2014-05-16";"2014-05-31";"0001-01-01";"D";"S";"UN ECHO DANS LE DESERT";"UN ECHO DANS LE DESERT";"promouvoir des activités physiques et sportives ; participer à des activités physiques et sportives ; participer à des évènements sportifs types course, trail et autres évènements publics liés au sport au niveau départemental, régional, national et international";"011000";"000000";"";"";"";"";"Flamands";"_";"97701";"97133";"Saint-Barthélemy";"";"chez M. Stéphane CROZATIER";"";"Flamands";"";"97133";"Saint-Barthélemy";"FRANCE";"PM";"";"0";"";"A";"2014-05-31 12:45:42"
"W9J1000088";"";"";"";"9J1T";"2014-05-19";"2014-05-19";"2014-06-14";"0001-01-01";"D";"S";"L'ECOLE DE RUGBY DES BARRACUDAS";"EDR DES BARRACUDAS";"faire pratiquer le rugby";"011080";"000000";"";"";"";"";"Vitet";"_";"97701";"97133";"Saint-Barthélemy";"";"";"";"Vitet";"";"97133";"Saint-Barthélemy";"FRANCE";"PM";"";"0";"";"A";"2014-06-15 18:45:18"
"W9J1000089";"";"";"";"9J1T";"2014-06-11";"2014-06-11";"2014-06-28";"0001-01-01";"D";"S";"THE HEART OF SAINT BARTH";"H.O.S.B";"créer des évènements autour de l'art et de la musique afin de mettre en avant les artistes en mettant à leur disposition des espaces, scènes, lieux afin qu'ils puissent exprimer leur talent ; reverser tous les bénéfices aux enfants défavorisés ou en difficulté";"006100";"020005";"";"";"";"";"Pointe Milou";"_";"97701";"97133";"Saint-Barthélemy";"";"";"C/o Carole's places";"Pointe Milou";"";"97133";"Saint-Barthélemy";"FRANCE";"PF";"";"0";"";"A";"2014-06-30 12:45:45"
"W9J1000090";"";"";"";"9J1T";"2014-06-11";"2014-06-11";"2014-06-28";"0001-01-01";"D";"S";"LES GAZELLES DE SAINT BARTH";"LES GAZELLES DE SAINT BARTH";"organiser, préparer et assurer la logistique permettant la participation complète de deux équipages au rallye-raid ""RALLYE AÏCHA DES GAZELLES"" édition 2015";"011000";"000000";"";"65";"";"RUE";"de la Paix Gustavia";"_";"97701";"97133";"Saint-Barthélemy";"";"";"";"65 RUE DE LA PAIX GUSTAVIA";"";"97133";"Saint-Barthélemy";"FRANCE";"PF";"";"0";"";"A";"2014-07-02 13:26:37"
"W9J1000091";"";"";"";"9J1T";"2014-07-07";"2014-07-07";"2014-07-26";"0001-01-01";"D";"S";"LE BITIN BRASS BAND";"B.B.B";"jouer de la musique de tout type dans le cadre de concerts privés ou de manifestations publiques";"006030";"000000";"Centre commercial de l'oasis";"";"";"";"Lorient";"_";"97701";"97133";"Saint-Barthélemy";"";"Centre commercial de l'oasis";"";"Lorient";"";"97133";"Saint-Barthélemy";"FRANCE";"PM";"";"0";"";"A";"2014-07-28 18:45:37"
"W9J1000092";"";"";"";"9J1T";"2014-09-05";"2014-09-05";"2014-09-20";"0001-01-01";"D";"S";"L'ATELIER DES MUZICIENS";"L'ATELIER DES MUZICIENS";"créer des évènements culturels et plus particulièrement des spectacles et festivals de musique, afin de promouvoir l'île de St Barthélemy à l'international ; réunir les jeunes autour d'ateliers de musique, d'éveil musical";"006030";"000000";"Gustavia";"23";"";"RUE";"schoelcher";"_";"97701";"97133";"Saint-Barthélemy";"";"Gustavia";"";"23  rue schoelcher";"";"97133";"Saint-Barthélemy";"FRANCE";"PF";"";"0";"";"A";"2014-09-22 18:45:43"
"W9J1000093";"12/11/1991";"";"";"9J1T";"1991-11-12";"2014-09-23";"1991-12-11";"0001-01-01";"D";"S";"SAINT-BARTH ANIMATION";"SAINT-BARTH ANIMATION";"organiser des animations musicales, créer des évènements sportifs, musicaux et culturels";"006030";"000000";"Radio transat";"";"";"";"Galeries du commerce Saint-Jean";"_";"97701";"97133";"Saint-Barthélemy";"";"Radio transat";"";"Galeries du commerce Saint-Jean";"";"97133";"Saint-Barthélemy";"FRANCE";"PM";"";"1";"";"A";"2015-03-24 20:00:05"
"W9J1000094";"";"";"";"9J1T";"2014-11-14";"2014-11-14";"2014-11-29";"0001-01-01";"D";"S";"ST BARTH YOGA & WELLNESS ASSOCIATION";"ST BARTH YOGA & WELLNESS ASSOCIATION";"enseigner, faire pratiquer et développer le yoga ainsi que des techniques de bien-être et de développement personnel par des praticiens résidents de l'île de St-Barthélemy et par des intervenants extérieurs formés et diplômés dans ces différentes méthodes; plus largement encore, l'association se réserve la possibilité d'intégrer ou de promouvoir toute activité complémentaire en accord avec ses valeurs et ses ambitions, ceci par tous les moyens comme l'organisation de cours, de stages, de formations, de conférences, de spectacles et d'évènements complémentaires; elle s'adresse à toute forme de public; outre les cotisations de ses membres, la vente et la diffusion des services et de ses produits, tout comme des dons peuvent assurer ses ressources et son développement";"040000";"040000";"Morne Le réduit";"";"";"";"Gustavia";"_";"97701";"97133";"Saint-Barthélemy";"";"Morne Le réduit";"";"Gustavia";"";"97133";"Saint-Barthélemy";"FRANCE";"PF";"";"0";"";"A";"2014-12-01 19:41:36"
"W9J1000095";"";"";"";"9J1T";"2014-11-18";"2014-11-18";"2014-12-20";"0001-01-01";"D";"S";"LES PLONGEURS DE SAINT-BARTHELEMY";"PSB";"promouvoir et protéger les intérêts économiques de la plongée ; oeuvrer pour développer et favoriser, par tous moyens appropriés sur les plans sportif et accessoirement artistique et scientifique, la connaissance et la protection du monde subaquatique, ainsi que celle de tous les sports et activités subaquatiques et connexes, notamment la pêche sous-marine, la plongée en scaphandre, l'apnée et la nage avec accessoires ; contribuer au respect des lois et règlements ayant pour objet la conservation de la faune, de la flore et des richesses sous-marines, notamment en tenant ses adhérents informés des dispositions édictées à cette fin";"011125";"000000";"Saint-Jean";"23";"";"RES";"Jean Bart";"_";"97701";"97133";"Saint-Barthélemy";"";"Saint-Jean";"";"23  résidence Jean Bart";"";"97133";"Saint-Barthélemy";"FRANCE";"PM";"";"0";"";"A";"2014-12-20 12:45:13"
"W9J1000096";"31/05/2005";"";"";"9J1T";"2005-05-31";"2014-12-09";"2005-07-02";"0001-01-01";"D";"S";"SAINT-BARTH BASKET-CLUB";"SAINT-BARTH BASKET-CLUB";"développer dans l'île de Saint-Barthélemy la pratique du basket-ball et favoriser les rencontres inter-îles";"011065";"000000";"";"";"";"";"Grande Saline";"_";"97701";"97133";"Saint-Barthélemy";"";"";"";"GRANDE SALINE";"";"97012";"SAINT-BARTHéLEMY";"FRANCE";"PM";"";"1";"";"A";"2015-06-10 20:00:06"
"W9J1000097";"";"";"";"9J1T";"2014-12-04";"2014-12-04";"2014-12-27";"0001-01-01";"D";"S";"ENTRE ELLE ET MER";"ENTRE ELLE ET MER";"permettre la rencontre, l'échange, l'entraide entre les personnes vivant sur des bateaux à Saint-Barthélemy ; être un trait d'union entre les administrations locales et une plateforme solidaire entre ces personnes";"050000";"000000";"La Capitainerie";"";"";"";"Gustavia";"_";"97701";"97133";"Saint-Barthélemy";"";"La capitainerie";"";"Gustavia";"";"97133";"Saint-Barthélemy";"FRANCE";"PM";"";"0";"";"A";"2015-01-19 18:35:40"
"W9J1000098";"";"";"";"9J1T";"2014-12-08";"2014-12-08";"2014-12-27";"0001-01-01";"D";"S";"ST BARTS HYLMAUDE DESIGN";"SBHD";"promouvoir et développer en local et à l'international toutes activités (boutiques, créateurs, stylistes...) et tout évènements concernant les acteurs de la mode, du stylisme, de la décoration, du relooking, installés sur l'île de Saint-Barthélemy et notamment l'organisation annuelle du ""ST BARTH FASHION SPIRIT"" ; ainsi que la défense des intérêts de ses membres et plus généralement toutes opérations commerciales ou financières, mobilières ou immobilières, pouvant se rattacher directement ou indirectement à l'objet social ou susceptibles d'en faciliter l'extension ou le développement";"022000";"000000";"";"";"";"";"Anse des Cayes";"_";"97701";"97012";"Saint-Barthélemy";"";"3 lotissement";"";"Anse des Cayes";"";"97012";"Saint-Barthélemy";"FRANCE";"PF";"";"0";"";"A";"2014-12-29 12:45:23"
"W9J1000099";"";"";"";"9J1T";"2015-01-22";"2015-11-27";"2015-01-31";"0001-01-01";"D";"S";"PINEAPPLE GIRLS";"PINEAPPLE GIRLS";"créer un groupe de carnaval";"006000";"000000";"";"";"";"";"Grande Saline";"_";"97701";"97133";"Saint-Barthélemy";"";"";"";"Grande Saline";"";"97133";"Saint-Barthélemy";"FRANCE";"PF";"";"0";"";"A";"2015-11-27 17:53:54"
"W9J1000100";"";"";"";"9J1T";"2015-03-25";"2015-06-12";"2015-04-04";"0001-01-01";"D";"S";"ITINERANTOUR";"ITINERANTOUR";"promouvoir et développer des produits et techniques favorisant le développement durable, la protection de la planète et le développement humain, dans tous les domaines d'activités à travers le globe ; pour se donner les moyens de fonctionner, l'association pourra fabriquer, commercialiser, importer ou exporter à l'international, ou organiser des évènements (code de ommerce article 1442-7) ; plus généralement toutes opérations de quelque nature qu'elles soient, juridiques, économiques, financières, immobilières, civiles et commerciales se rapportant directement ou indirectement à l'objet social ou susceptible d'en faciliter l'extension ou le développement";"024050";"000000";"";"";"";"";"Grand cul de sac";"_";"97701";"97133";"Saint-Barthélemy";"";"CHEZ FRANçOIS QUESTEL";"";"GRAND CUL DE SAC";"";"97133";"SAINT-BARTHéLEMY";"FRANCE";"PM";"";"0";"";"A";"2015-12-11 20:00:03"
"W9J1000101";"";"";"";"9J1T";"2015-04-09";"2015-04-09";"2015-05-09";"0001-01-01";"D";"S";"OUANALAO REEF";"OUANALAO REEF";"conserver, réhabiliter, implanter, mettre en valeur les récifs coralliens et écosystèmes marins de Saint-Barthélemy";"024030";"024035";"";"";"";"";"Marigot";"_";"97701";"97133";"Saint-Barthélemy";"";"";"";"Marigot";"";"97133";"Saint-Barthélemy";"FRANCE";"PM";"";"0";"";"A";"2015-05-09 12:45:12"
"W9J1000102";"";"";"";"9J1T";"2015-05-05";"2024-05-30";"2015-05-16";"0001-01-01";"D";"S";"CORAL RESTORATION ST BARTH";"CORAL RESTORATION ST BARTH";"préserver et restaurer les écosystèmes coralliens ; développer des programmes de recherche pour comprendre, valoriser et restaurer les récifs coralliens ; participer à l'installation de sites de nurseries, de favoriser la restauration d'habitats pour la biodiversité marine ; de sensibiliser les communautés locales et le grand public ; de défendre en justice les intérêts qu'elle a pour objet de défendre ; préserver et restaurer les littoraux marins  ; prélever régulièrement des espèces invasives (tels que les poissons-lions) ;
de faire découvrir les fonds marins via un club de plongée associatif dans le but de sensibiliser un plus grand nombre de personnes par la plongée sous-marine";"024035";"000000";"bp 566";"";"";"";"Merlette";"_";"97701";"97133";"Saint-Barthélemy";"";"BP 566";"";"MERLETTE";"";"97133";"SAINT-BARTHéLEMY";"FRANCE";"PM";"";"0";"";"A";"2024-11-29 19:09:05"
"W9J1000103";"";"";"";"9J1T";"2015-06-04";"2015-06-04";"2015-07-18";"0001-01-01";"D";"S";"FELDENKRAIS ST BARTH";"FELDENKRAIS ST BARTH";"promouvoir l'éducation somatique (apprentissage de la conscience du corps en mouvement dans son environnement) à travers la méthode Feldenkrais";"011000";"050000";"Gustavia";"56";"";"RUE";"Irénée de Bruyn";"_";"97701";"97133";"Saint-Barthélemy";"";"Gustavia";"";"56  rue Irénée de Bruyn";"";"97133";"Saint-Barthélemy";"FRANCE";"PF";"";"0";"";"A";"2015-07-18 12:45:10"
"W9J1000104";"24/07/84";"";"";"9J1T";"1984-07-24";"2018-11-08";"0001-01-01";"0001-01-01";"D";"S";"ASSOCIATION SAINT-BARTH DES AMIS DE LA SUEDE";"A.S.B.A.S.";"agir en sorte que soient sauvegardés et soigneusement conservés les vestiges de la présence suédoise à Saint-Barthélemy ainsi que les archives et objets se rapportant à l'époque suédoise de l'île de 1784 à 1878, en tout lieu qu'ils peuvent se trouver ; promouvoir la recherche culturelle et artistique portant sur l'époque et les questions qui s'y rattachent ; favoriser le développement des relations entre Saint-Barthélemy et la Suède";"010000";"000000";"";"";"";"";"Gustavia";"_";"97701";"97133";"Saint-Barthélemy";"";"";"";"Anse des Cayes";"";"97133";"Saint-Barthélemy";"FRANCE";"PM";"infosb.com";"1";"";"A";"2018-11-09 15:40:25"
"W9J1000105";"";"";"";"9J1T";"2015-09-25";"2015-09-25";"2015-10-24";"0001-01-01";"D";"S";"PANDA FREEDIVING SCHOOL";"PANDA FREEDIVING SCHOOL";"développer la pratique de l'apnée de loisir et sportive auprès de la population intéressée, certifier le cas échéant les personnes intéressées par le passage de niveau d'apnée AIDA";"011125";"000000";"";"";"";"";"Petit Cul de SAc";"_";"97701";"97133";"Saint-Barthélemy";"";"";"";"Petit Cul de SAc";"";"97133";"Saint-Barthélemy";"FRANCE";"PF";"";"0";"";"A";"2015-10-24 12:45:19"
"W9J1000106";"";"";"";"9J1T";"2015-09-23";"2017-12-01";"2015-10-24";"0001-01-01";"D";"S";"L' ENVOLÉE";"L' ENVOLÉE";"participer financièrement, organiser, planifier les départs et séjours des danseurs de Saint-Barthélemy aux concours nationaux (Métropole), européens et internationaux ; participer financièrement, organiser, planifier des stages de danses à Saint-Barthélemy, faire venir des professeurs qualifiés afin qu'ils puissent enseigner d'autres formes de danses et ouvrir l'esprit de nos danseurs ; participer financièrement, organiser, planifier les participations de nos danseurs à des stages de danses à l'extérieur de l'île de St-Barthélemy (îles voisines, métropole, étranger) ; organiser des actions pour récolter des fonds : vente de gâteaux, tombola, vide grenier, aide aux personnes, recherche de sponsors etc...";"011045";"000000";"maison Hervé Turbé";"";"";"";"Flamands";"_";"97701";"97133";"Saint-Barthélemy";"";"";"CHEZ M. HERVé TURBÉ";"FLAMANDS";"";"97133";"SAINT-BARTHéLEMY";"FRANCE";"PF";"";"0";"";"A";"2018-06-02 20:00:03"
"W9J1000107";"";"";"";"9J1T";"2015-10-13";"2019-04-04";"2015-10-24";"2019-02-19";"D";"S";"ASSOCIATION DES PROFESSIONNELS DE SANTÉ LIBÉRAUX DE SAINT BARTHELEMY";"A.P.S.L.SBH";"représenter les Masseurs Kinésithérapeutes et les Infirmières (ers) conventionnés exerçant à Saint-Barthélemy dans toutes les instances officielles ou privées afin de garantir la qualité et la sécurité des soins ainsi que leur pérennité à Saint-Barthélemy, défendre les intérêts corporatifs économiques, sociaux ou moraux des Masseurs Kinésithérapeutes et des infirmières (ers), de favoriser et de promouvoir la formation des Masseurs Kinésithérapeutes et des Infirmières (ers), émettre des propositions relatives à l'organisation du système de santé comme l'organisation des soins entre professionnels libéraux et secteur hospitalier, la démographie professionnelle, la permanence des soins, la formation continue professionnelle et interprofessionnelle";"017020";"000000";"";"";"";"";"Corossol";"_";"97701";"97133";"Saint-Barthélemy";"";"la roche dans l'eau";"";"Corossol";"";"97133";"Saint-Barthélemy";"FRANCE";"PF";"";"0";"";"D";"2019-04-30 18:10:33"
"W9J1000108";"";"";"";"9J1T";"2015-10-14";"2015-10-14";"2015-10-24";"0001-01-01";"D";"S";"GYMNASTIQUE CLUB SAINT-BARTH";"GCSB";"faire découvrir et pratiquer toutes les activités gymniques proposées par la Fédération Française de Gymnastique FFG en loisirs et en compétition";"011105";"000000";"La Grand'Roche";"";"";"";"Colombier";"_";"97701";"97133";"Saint-Barthélemy";"";"La Grand'Roche";"";"Colombier";"";"97133";"Saint-Barthélemy";"FRANCE";"PM";"";"0";"";"A";"2015-10-24 12:46:36"
"W9J1000109";"19/06/2002";"";"";"9J1T";"2002-06-19";"2015-10-16";"2002-07-20";"0001-01-01";"D";"S";"SAINT-B'ART";"SAINT-B'ART";"promouvoir et organiser toutes activités artistiques ou culturelles ; organiser des manifestations, spectacles, expositions, concerts, représentations théâtrales, organiser des stages de dessin, peinture, sculpture, danse, ateliers de littérature et tout ce qui en général contribue au développement culturel et au rayonnement de Saint-Barthélemy ; assister techniquement et financièrement des jeunes vocations dans le domaine artistique";"006100";"000000";"Les grands fonds";"";"";"";"";"_";"97701";"97133";"Saint-Barthélemy";"";"";"";"LES GRANDS FONDS";"";"97133";"SAINT-BARTHéLEMY";"FRANCE";"PM";"";"1";"";"A";"2016-04-16 20:00:03"
"W9J1000110";"";"";"";"9J1T";"2015-10-19";"2024-05-13";"2015-11-14";"2024-02-21";"D";"S";"BIENVEILLANCE SBH";"YOGA & ÉDUCATION";"contribuer à la promotion et à l'apprentissage du yoga, de l'éducation des enfants, des adultes par l'intermédiaire de formations et de tous types d'activités en relation avec l'apprentissage des techniques de bien être et d'éducation ; créer, exploiter, promouvoir et organiser des évènements et des manifestations à travers des cours, des soirées, des stages, des concerts, des représentations et des festivals autour du yoga, de l'expression corporelle, et de l'éducation sur la non violence et la pédagogie positive";"007085";"000000";"5 La plantation";"";"";"";"Saint-Jean carénage";"_";"97701";"97133";"Saint-Barthélemy";"";"5 LA PLANTATION";"";"SAINT-JEAN CARéNAGE";"";"97133";"SAINT-BARTHéLEMY";"FRANCE";"PF";"";"0";"";"D";"2024-05-21 10:08:38"
"W9J1000111";"04/07/2001";"82360633000012";"";"9J1T";"2001-07-04";"2024-12-19";"2001-08-04";"0001-01-01";"D";"S";"ASSOCIATION DE SPORTS COLLECTIFS AQUATIQUES DE ST-BARTH";"A.S.C.A.S.";"pratiquer et enseigner la plongée sous-marine et ses activités annexes ; pratiquer l'apnée en mer ou en milieu artificiel ; nager avec des palmes en mer ou en milieu artificiel ; pratiquer toute activité mettant en jeu des techniques utilisées en plongée sous-marine ; pratiquer la natation et le renforcement musculaire en mer et en milieu artificiel ; pratiquer des activités collectives de ballon (type water-polo) en mer et en milieu artificiel ;";"011125";"000000";"Pointe Milou";"";"";"";"";"_";"97701";"97133";"Saint-Barthélemy";"";"";"";"CENTRE ADMINISTRATIF DE LORIENT";"BOITE 32";"97133";"ST BARTHELEMY";"FRANCE";"PF";"";"1";"";"A";"2024-12-19 18:25:50"
"W9J1000112";"03/02/1988";"";"";"9J1T";"1988-02-03";"2020-12-04";"1988-03-02";"0001-01-01";"D";"S";"LES FRANCS-ARCHERS DE SAINT-BARTH";"LES FRANCS-ARCHERS DE SAINT-BARTH";"pratiquer le tir à l'arc ; tenir des assemblées périodiques, des conférences et cours sur les questions sportives et, en général, tous les exercices et toutes initiatives propres à la formation physique et morale de la jeunesse";"011175";"000000";"plaine des jeux";"";"";"";"Saint-Jean";"_";"97701";"97133";"Saint-Barthélemy";"";"";"";"SAINT-JEAN";"";"97133";"SAINT-BARTHÉLEMY";"FRANCE";"PM";"";"1";"";"A";"2021-06-05 20:00:03"
"W9J1000113";"";"";"";"9J1T";"2015-11-19";"2015-11-19";"2015-12-05";"0001-01-01";"D";"S";"SAINT BARTH SPORT OCEAN";"SBH SPORT OCEAN";"organiser des évènements nautiques et maritimes ; former à la voile, à la course croisières et aux sports nautiques (voile lègère) et sports de glisse";"011185";"011095";"Lorient";"";"";"";"lieu dit camaruche";"_";"97701";"97133";"Saint-Barthélemy";"";"";"";"Lorient lieu dit camaruche";"";"97133";"Saint-Barthélemy";"FRANCE";"PM";"";"0";"";"A";"2015-12-07 20:04:20"
"W9J1000114";"";"";"";"9J1T";"2015-11-04";"2015-11-04";"2015-12-05";"0001-01-01";"D";"S";"SAINT BARTH EXPO";"ST BARTH EXPO";"mettre en oeuvre des expositions d'art à vocation culturelle et pédagogique et toutes manifestations (ou actions) annexes ou complémentaires se rattachant à cette activité";"006020";"006100";"Gustavia";"16";"";"RUE";"Jeanne d'Arc";"_";"97701";"97133";"Saint-Barthélemy";"";"GUSTAVIA";"";"16  rue JEANNE D'ARC";"";"97133";"Saint-Barthélemy";"FRANCE";"PF";"";"0";"";"A";"2015-12-07 20:04:20"
"W9J1000115";"26/07/2007";"";"";"9J1T";"2015-11-27";"2016-02-25";"2007-09-08";"0001-01-01";"D";"S";"ASSOCIATION DES PROPRIETAIRES INTERNATIONAUX DE SAINT-BARTHELEMY";"ASSOCIATION DES PROPRIETAIRES INTER...";"préserver et améliorer la qualité de vie pour tous à Saint-Barthélemy ; représenter les intérêts des propriétaires privés internationaux de Saint-Barthélemy";"050000";"000000";"selarl Gkg";"";"";"";"rue Chanzy Gustavia";"_";"97701";"97133";"Saint-Barthélemy";"";"selarl Gkg";"";"rue Chanzy Gustavia";"";"97133";"Saint-Barthélemy";"FRANCE";"PM";"";"1";"";"A";"2016-08-26 20:00:02"
"W9J1000116";"";"";"";"9J1T";"2015-12-04";"2015-12-04";"2015-12-19";"0001-01-01";"D";"S";"LES FEMMES DE OUANA";"LES FEMMES DE OUANA";"rassembler les femmes autour d'évènements culturels et sportifs qui favorisent leur épanouissement et leur bien-être ; faire découvrir et promouvoir la pratique d'activités sportives, artistiques, culturelles, ludiques, créatives, relaxantes ; proposer des techniques de relaxation qui initient au bien-être et le favorise ; encourager des techniques innovantes et expérimentales qui participent à l'enrichissement personnel et au bien-être des femmes ; développer la pratique artistique et sportive de la pole dance ; initier, soutenir, diffuser tout projet amateur ou professionnel qui a pour objet de favoriser le bien être physique et moral ; renforcer les liens et les échanges autour de projets sportifs et culturels et développer es synergies avec d'autres réseaux ; développer une plateforme de mise en réseaux et de mise à disposition de biens et services";"006000";"011000";"la Case des Sables";"";"";"";"Saint-Jean";"_";"97701";"97133";"Saint-Barthélemy";"";"La case des sables";"";"Saint-Jean";"";"97133";"Saint-Barthélemy";"FRANCE";"PF";"";"0";"";"A";"2016-01-12 19:53:52"
"W9J1000117";"";"";"";"9J1T";"2015-12-09";"2023-12-04";"2015-12-19";"0001-01-01";"D";"S";"PELICAN'S BASKET CLUB";"PELICAN'S BASKET CLUB";"pratiquer et promouvoir le basket pour les adultes de Saint-Barthélemy";"011065";"000000";"Gustavia";"11";"";"RUE";"DES MARINS";"_";"97701";"97133";"Saint-Barthélemy";"";"";"GUSTAVIA";"11  RUE DES MARINS";"";"97133";"SAINT-BARTHéLEMY";"FRANCE";"PM";"";"0";"";"A";"2024-06-04 18:06:28"
"W9J1000118";"";"";"";"9J1T";"2016-01-20";"2017-10-09";"2016-01-30";"0001-01-01";"D";"S";"SAINT-BARTH MUZIK";"SBM";"promouvoir la musique traditionnelle antillaise et caribéenne, soutenir et accompagner la pratique musicale et toutes activités pouvant y être rattachées";"006030";"000000";"Villa Ocea";"";"";"";"Route de Saline";"_";"97701";"97133";"Saint-Barthélemy";"";"Villa Ocea";"";"Route de Saline";"";"97133";"Saint-Barthélemy";"FRANCE";"PF";"";"0";"";"A";"2017-10-09 20:33:06"
"W9J1000119";"";"";"";"9J1T";"2016-02-01";"2016-02-01";"2016-02-27";"0001-01-01";"D";"S";"MEDITRINE";"MEDITRINE";"favoriser le développement personnel de chacun afin de vivre en bonne santé physique, psychique, émotionnelle et spirituelle ; proposer des rencontres de qualités en collaboration avec des intervenants extérieurs ; promouvoir, développer et soutenir la recherche ; organiser des voyages d'études ; financer des formations ; créer ou soutenir des évènements à visées informatives, éducatives et/ou caritatives ; faire des dons financiers ou en nature à toutes autres associations ; soutenir par des dons de toute nature des structures existantes ; favoriser l'accès aux soins aux plus démunis ; créer ou contribuer à la création de lieux de vie, et participer à leurs fonctionnements ; s'appuyer sur l'effort collectif notamment dons, partenariats, bénévolats";"050000";"000000";"";"";"";"";"Salines";"_";"97701";"97133";"Saint-Barthélemy";"";"";"";"Salines";"";"97133";"Saint-Barthélemy";"FRANCE";"PF";"";"0";"";"A";"2016-03-02 12:45:14"
"W9J1000120";"";"";"";"9J1T";"2016-02-16";"2016-08-31";"2016-02-27";"2016-08-26";"D";"S";"ST-BARTH SKATEPARK";"ST-BARTH SKATEPARK";"créer une structure en béton appelée ""Skatepark"" rassemblant toutes les disciplines de sport de glisse urbain";"011130";"000000";"";"";"";"";"Colombier";"_";"97701";"97133";"Saint-Barthélemy";"";"Chez Edith GREAUX";"maison du bas";"Colombier";"";"97133";"Saint-Barthélemy";"FRANCE";"PM";"";"0";"";"D";"2016-10-11 21:32:13"
"W9J1000121";"";"";"";"9J1T";"2016-02-26";"2016-05-10";"2016-03-19";"0001-01-01";"D";"S";"ST BARTH'S TOUCH";"ST BARTH'S TOUCH";"rassembler les prestataires de massage qualifiés et passionnés, faciliter la logistique relative à l'exercice du métier et promouvoir l'art du massage ; créer et référencer les prestataires de qualité, organiser une plateforme logistique et mettre en place une action publicitaire commune";"017000";"000000";"";"";"";"";"Anse des Lézards";"_";"97701";"97133";"Saint-Barthélemy";"";"Vitet";"Ensemble LAPLACE";"";"";"97133";"Saint-Barthélemy";"FRANCE";"PF";"www.stbarthstouch.com";"0";"";"A";"2016-11-08 20:00:05"
"W9J1000122";"";"";"";"9J1T";"2016-03-10";"2016-03-10";"2016-04-09";"0001-01-01";"D";"S";"ASSOCIATION DES CARIBBEAN GIRLS";"A.C.G.";"organiser un char carnavalesque à Saint-Barthélemy et d'en faire assurer le succès populaire tout en restant dans les limites de la bonne morale et de la bienséance, la principale manifestation étant le défilé carnavalesque annuel de Saint-Barthélemy";"006000";"000000";"";"";"";"";"Vitet";"_";"97701";"97133";"Saint-Barthélemy";"";"";"";"Vitet";"";"97133";"Saint-Barthélemy";"FRANCE";"PF";"";"0";"";"A";"2016-04-09 12:45:09"
"W9J1000123";"07/04/1997";"";"";"9J1T";"1997-04-07";"2024-03-25";"1997-05-10";"0001-01-01";"D";"S";"ASSOCIATION POUR LA SAUVEGARDE DU QUARTIER DE PUBLIC";"A.S.P.";"lutter contre les agressions à la santé, à la sécurité et au bien-être des habitants du quartier de Public ; entreprendre les démarches pour que les lois sur l'environnement et la qualité de la vie soient respectées ; organiser la fête du quartier de Public et d'autres évènements";"024045";"000000";"local de la Collectivité, ancienne citerne communale";"";"";"";"public";"_";"97701";"97133";"Saint-Barthélemy";"";"LOCAL DE LA COLLECTIVITé";"ANCIENNE CITERNE COMMUNALE";"PUBLIC";"";"97133";"SAINT-BARTHéLEMY";"FRANCE";"PF";"";"1";"";"A";"2024-04-16 10:08:35"
"W9J1000124";"18/09/1995";"";"";"9J1T";"1995-09-01";"2020-06-16";"1901-07-01";"0001-01-01";"D";"S";"ASSOCIATION DES RESTAURATEURS DE SAINT-BARTHELEMY - ARSB";"ARSB";"resserer les liens, l'entraide et l'harmonie existants entre les membres, notamment par des publications, réunions, congrès ; représenter et défendre les intérêts de ses membres, dans le cadre des lois, auprès des pouvoirs publics, administrations, organismes privés et plus généralement de toutes autorités et corps constitués ; contribuer à la promotion commerciale de ses membres notamment par des manifestations publiques et privées de toute nature ou tous types d'actions marketing favorables";"022542";"000000";"Gustavia";"4";"";"RUE";"Lubin BRIN";"_";"97701";"97012";"Saint-Barthélemy";"";"CHEZ BONITO";"GUSTAVIA";"15 RUE DU PèRE IRéNéE DE BRUYN";"";"97133";"SAINT-BARTHéLEMY";"FRANCE";"PM";"";"1";"";"A";"2020-12-15 20:00:03"
"W9J1000125";"";"";"";"9J1T";"2016-06-06";"2021-09-07";"2016-06-18";"0001-01-01";"D";"S";"TEAM FWI - ESPORT";"TEAM FWI - ESPORT";"pratiquer et promouvoir des activités liées aux compétitions de jeux vidéo dit eSport et toute action compatible avec cet objet qui s'y rapporte et contribue à sa réalisation";"011000";"000000";"";"";"";"";"Grand Cul de Sac";"_";"97701";"97133";"Saint-Barthélemy";"";"chez M. LEMAISTRE Bruno";"villa Lagon Bleu";"Grand cul de sac";"";"97133";"Saint-Barthélemy";"FRANCE";"PM";"";"0";"";"A";"2021-09-16 21:41:19"
"W9J1000126";"";"";"";"9J1T";"2016-06-24";"2017-07-20";"2016-07-09";"0001-01-01";"D";"S";"GUSTAVIA YACHT CLUB";"GUSTAVIA YACHT CLUB";"promouvoir par des actions non lucratives les activités de yachting sur l'île de Saint Barthélemy, d'y constituer le centre de la vie nautique et de développer la convivialité et une communauté d'intérêts entre les plaisanciers de Saint Barthélemy grâce notamment à la mise à disposition de ses membres d'un lieu de réunion à Gustavia ; des initiatives d'intérêt collectif telles que l'organisation de régates, croisières, convoyages et manifestations sportives ; l'optimisation par regroupement d'achats d'équipements renouvelables et de fournitures, ainsi que des frais de contrôle et d'entretien des mouillages ; des animations et actions permettant aux membres de mieux se connaître et à l'association de gagner en notoriété ; des relations avec tous les acteurs de ces mêmes activités dans le monde ainsi qu'avec d'autres ports et avec les autorités et professionnels du port de Gustavia ; l'organisation de toute activité susceptible de lui procurer des fond telles que la conception";"022000";"000000";"APPARTEMENT MAHI résidence Marlin";"20";"";"RUE";"Jeanne d'Arc Gustavia";"_";"97701";"97133";"Saint-Barthélemy";"";"Villa BAC";"";"Saint-Jean carénage";"";"97133";"Saint-Barthélemy";"FRANCE";"PM";"";"0";"";"A";"2017-08-17 21:12:26"
"W9J1000127";"";"";"";"9J1T";"2016-06-30";"2016-06-30";"2016-07-23";"0001-01-01";"D";"S";"GÉNÉRATION ST BARTH";"GÉNÉRATION ST BARTH";"définir et promouvoir les conditions d'une nouvelle offre politique, regrouper toutes celles et tous ceux, citoyens, élus locaux, parlementaires, qui sont attachés à la sauvegarde de Saint-Barthélemy, de son identité, de son patrimoine et de son écologie et qui entendent développer une ambition innovante et collective pour Saint-Barthélemy, axée sur la préservation de l'environnement, un juste équilibre de l'urbanisation, tout en y associant le développement touristique";"001015";"000000";"";"";"";"";"Grand-Fond";"_";"97701";"97133";"Saint-Barthélemy";"";"Chez Clémence Berry";"";"Grand-Fond";"";"97133";"Saint-Barthélemy";"FRANCE";"PM";"";"0";"";"A";"2016-07-23 12:45:09"
"W9J1000128";"";"";"";"9J1T";"2016-07-25";"2016-07-25";"2016-08-06";"0001-01-01";"D";"S";"LES GAULOIS DE SAINT BARTHÉLEMY";"LES GAULOIS DE SAINT BARTHÉLEMY";"pratiquer le football, participer pleinement à la vie des collectivités locales et territoriales, contribuer à donner l'accès au football aux employés des différents hôtels et restaurants à Saint-Barthélemy dans un esprit sportif";"011075";"000000";"RES BELLA PLAGE APP 2";"";"";"";"Lorient";"_";"97701";"97133";"Saint-Barthélemy";"";"RES BELLA PLAGE APP 2";"";"Lorient";"";"97133";"Saint-Barthélemy";"FRANCE";"PM";"";"0";"";"A";"2016-08-06 12:45:18"
"W9J1000129";"";"";"";"9J1T";"2016-07-01";"2025-02-26";"2016-08-13";"0001-01-01";"D";"S";"ISLAND NATURE ST-BARTH EXPERIENCES";"IN ST BARTH EXPERIENCES";"développer un réseau de bénévoles et volontaires à Saint-Barthélemy ;  développer toute action d'utilité locale dans les domaines de l'environnement, du patrimoine, du socio-culturel, de l'action sociale et solidaire ; initier et/ou soutenir des chantiers de sauvegarde et de restauration du patrimoine naturel et culturel ; regrouper des porteurs de projets, associatifs ou non, qui mettent en uvre des activités de travail volontaire au profit de l'intérêt général ; favoriser leur mise en relation et la participation des bénévoles, volontaires ; faciliter l'accès de tous à des actions collectives et éducatives ; partager les connaissances, les savoir-faire ; favoriser les échanges et le partage";"024050";"010000";"";"";"";"";"Vitet";"_";"97701";"97133";"Saint-Barthélemy";"";"";"";"Vitet";"";"97133";"Saint-Barthélemy";"FRANCE";"PM";"";"0";"";"A";"2025-02-26 15:55:59"
"W9J1000130";"";"";"";"9J1T";"2016-08-02";"2024-02-14";"2016-08-20";"0001-01-01";"D";"S";"CROWS OF HELL RIDERS";"CROWS OF HELL RIDERS";"promouvoir la passion de la moto au travers de ballades et toutes manifestations d'ordre touristique, participer à des manifestations locales, fêtes, salons, expositions, etc... ; participer et organiser des uvres caritatives diverses, accompagner les jeunes à la pratique du deux roues motorisés ; vendre des produits dérivés ""Crows of hell riders"" ; organiser des évènements, concerts, festivals, ect... ; vendre des boissons et restauration (snacking)";"011160";"000000";"villa clair de lune";"";"";"";"Lurin";"_";"97701";"97133";"Saint-Barthélemy";"";"VILLA CLAIR DE LUNE";"";"LURIN";"";"97133";"SAINT-BARTHéLEMY";"FRANCE";"PM";"";"0";"";"A";"2024-02-16 17:33:58"
"W9J1000131";"";"";"";"9J1T";"2016-08-09";"2018-08-17";"2016-08-20";"2018-08-15";"D";"S";"THE WOODCUTTERS BIKERS SBH MCP";"THE WOODCUTTERS BIKERS SBH MCP";"créer des évènements autour du monde du deux roues et de la sécurité routière en scoot et moto";"011160";"000000";"";"";"";"";"Anse des Cayes";"_";"97701";"97133";"Saint-Barthélemy";"";"Chez Michael et Angelica GREAUX";"";"Anse des Cayes";"";"97133";"Saint-Barthélemy";"FRANCE";"PM";"";"0";"";"D";"2018-08-30 16:34:58"
"W9J1000132";"";"";"";"9J1T";"2016-08-29";"2016-08-29";"2016-09-10";"0001-01-01";"D";"S";"IN MY KITCHEN";"IN MY KITCHEN";"développer et promouvoir des activités dans le domaine culinaire (cuisine & pâtisserie) à destination des enfants et des familles dans la perspective d'une meilleure alimentation quotidienne et familiale";"050000";"000000";"grande savane";"";"";"";"Public";"_";"97701";"97133";"Saint-Barthélemy";"";"Grande Savane";"";"Public";"";"97133";"Saint-Barthélemy";"FRANCE";"PF";"";"0";"";"A";"2016-10-11 20:15:02"
"W9J1000133";"";"";"";"9J1T";"2016-10-04";"2016-10-04";"2016-10-22";"0001-01-01";"D";"S";"DOMAINE FÉLICITÉ";"DOMAINE FÉLICITÉ";"assurer la sauvegarde du patrimoine culturel, historique, architectural, floral, faunique et gastronomique de Saint-Barthélemy ; proposer sa découverte par la création d'un jardin d'agrément et dans des locaux d'époques, des expositions et tous documents ou objets se rapportant aux origines, à l'histoire, aux coutumes et traditions locales ; rechercher et diffuser toutes documentations et témoignages sur l'histoire de Saint-Barthélemy et de sa population ; organiser des évènements culturels et plus largement toutes actions susceptibles d'en favoriser la réalisation et le développement ; vendre de façon habituelle tous types de produits, fournitures ou services se rapportant à l'objet principal pour en assurer son bon fonctionnement";"010000";"000000";"Public";"";"";"LD";"La tourmente";"_";"97701";"97133";"Saint-Barthélemy";"";"SECCSB/Société d'Expertise Comptable";"Marigot";"lieu dit Les 4 chemins";"";"97133";"Saint-Barthélemy";"FRANCE";"PM";"";"0";"";"A";"2016-10-22 12:45:11"
"W9J1000134";"";"";"";"9J1T";"2016-09-21";"2016-09-21";"2016-10-22";"0001-01-01";"D";"S";"SAINT-BARTH MOTO CROSS";"SAINT-BARTH MOTO CROSS";"organiser les entrainements et compétitions de motocross et quad cross";"011160";"000000";"";"";"";"";"Grand cul de sac";"_";"97701";"97133";"Saint-Barthélemy";"";"";"";"Grand cul de sac";"";"97133";"Saint-Barthélemy";"FRANCE";"PM";"";"0";"";"A";"2016-10-22 12:45:07"
"W9J1000135";"";"";"";"9J1T";"2016-11-23";"2016-11-23";"2016-12-03";"0001-01-01";"D";"S";"CHABAD SBH";"CHABAD SBH";"promouvoir et diffuser le judaïsme par le biais d'activités sociales, culturelles, éducatives et sportives non lucratives";"040000";"000000";"";"";"";"";"Merlette";"_";"97701";"97133";"Saint-Barthélemy";"";"SCP SIMORRE ET CIFFREO";"";"Merlette";"";"97133";"Saint-Barthélemy";"FRANCE";"PM";"";"0";"";"A";"2016-12-03 12:45:38"
"W9J1000136";"";"";"";"9J1T";"2016-12-09";"2020-03-26";"2016-12-24";"0001-01-01";"D";"S";"UNITED ARTISTS OF SAINT BARTH";"UNITED ARTISTS OF SAINT BARTH";"faire connaître la production artistique de l'île de Saint-Barthélemy";"006100";"000000";"coupe Gorge villa Kalliste";"";"";"";"";"_St Jean";"97701";"97012";"Saint-Barthélemy";"";"COUPE GORGE VILLA KALLISTE";"";"ST JEAN";"";"97012";"SAINT-BARTHÉLEMY";"FRANCE";"PM";"";"0";"";"A";"2020-09-25 20:00:07"
"W9J1000137";"";"";"";"9J1T";"2016-12-14";"2024-11-22";"2017-02-11";"0001-01-01";"D";"S";"ASSOCIATION PRIVÉE DES TENNIS DU DOMAINE DU LEVANT";"A.P.T.D.L.";"assurer la gestion de l'utilisation des courts de tennis du Domaine et leur entretien";"050000";"000000";"Villa Silver Rainbow";"";"";"";"Petit cul de sac domaine du levant";"_";"97701";"97133";"Saint-Barthélemy";"";"VILLA SILVER RAINBOW";"";"Petit cul de sac domaine du levant";"";"97133";"Saint-Barthélemy";"FRANCE";"PM";"";"0";"";"A";"2024-12-16 13:43:57"
"W9J1000138";"";"";"";"9J1T";"2017-02-13";"2017-02-13";"2017-02-25";"0001-01-01";"D";"S";"OUANALAO GAMES";"OUANALAO GAMES";"développer la pratique des jeux de société sur l'île de Saint-Barthélemy. La liste des jeux pratiqués au sein de l'association devra faire l'objet d'une autorisation par le conseil d'administration de l'association qui autorisera la pratique des jeux au sein de ""sections de jeux"". L'autorisation de pratiquer un jeu au sein de l'association pourra être retirée par décision du conseil d'administration. La pratique de jeux d'argent est interdite au sein de l'association";"050000";"000000";"";"";"";"";"Flamands";"_";"97701";"97133";"Saint-Barthélemy";"";"";"";"Flamands";"BP 34";"97133";"Saint-Barthélemy";"FRANCE";"PM";"";"0";"";"A";"2017-02-27 12:45:30"
"W9J1000139";"";"";"";"9J1T";"2017-03-22";"2017-03-22";"2017-04-01";"0001-01-01";"D";"S";"LES DROITS DU PIETON SBH";"LES DROITS DU PIETON SBH";"défendre et sauvegarder les droits du piéton dans tous les domaines notamment lors de l'élaboration des décisions sur les projets d'équipement, d'aménagement de voirie ou de réglementation pouvant les concerner ; participer à l'amélioration du cadre et de la qualité de la vie, notamment en matière d'urbanisme et de transports, ainsi qu'à la protection de l'environnement ; promouvoir les déplacements à pied ; promouvoir ou réclamer toute mesure de nature à favoriser directement ou indirectement le respect de l'affectation des trottoirs à la circulation des piétons ; lutter contre les décisions règlementaires ou individuelles portant atteinte aux droits des piétons sur les emplacements normalement affectés à leur circulation, à savoir, de façon non limitative, les permissions de voirie, les autorisations de stationnement de véhicules, les autorisations de terrasse, d'étalage, les implantations de mobilier urbain public ; participer à la lutte contre l'insécurité routière, dans tous les lieux où les piétons sont concernés, par toute action de formation, d'éducation, etc";"019042";"036535";"Gustavia";"31";"";"RUE";"Victor Shoelcher";"_";"97701";"97133";"Saint-Barthélemy";"";"GUSTAVIA";"";"";"BP 281";"97096";"Saint-Barthélemy";"FRANCE";"PM";"";"0";"";"A";"2017-04-03 14:08:54"
"W9J1000140";"";"";"";"9J1T";"2017-05-03";"2019-04-09";"2017-05-13";"2019-04-05";"D";"S";"LA FERME DES SUCRIERS";"LA FERME DES SUCRIERS";"développer l'éducation citoyenne et l'éducation à l'écologie ; donner les moyen au plus grand nombre d'agir pour la protection de l'environnement et adopter des modes de vie respectueux de l'humain et de la planète ; faciliter la coopération entre les acteurs de la société et contribuer ainsi à la réhabilitation et au renforcement du lien social et de la solidarité";"024050";"000000";"";"";"";"";"Marigot";"_";"97701";"97133";"Saint-Barthélemy";"";"LIEU DIT LES 4 CHEMINS";"";"MARIGOT";"";"97133";"SAINT-BARTHéLEMY";"FRANCE";"PM";"";"0";"";"D";"2019-05-04 12:45:36"
"W9J1000141";"";"";"";"9J1T";"2017-06-06";"2017-06-06";"2017-06-24";"0001-01-01";"D";"S";"LES SAINT-BARTH SISTERS";"SBS";"développer la pratique du chant, la formation et l'éducation musicale de ses membres, notamment par des répétitions, sorties ; organiser des manifestations et spectacles dans lesquels le groupe musical se produit ; mettre en oeuvre tous les moyens propres à favoriser la culture musicale";"006030";"000000";"Résidence Les Gaiacs";"";"";"";"Lurin";"_";"97701";"97133";"Saint-Barthélemy";"";"Résidence Les Gaiacs";"";"Lurin";"";"97133";"Saint-Barthélemy";"FRANCE";"PF";"";"0";"";"A";"2017-06-24 12:45:07"
